"id","rating","vote","asin","user_id","reviewText"
"4493","5","","B01CNT0L54","4f2bcfc4b501e676833426c3eeb058cfMBL1","Every so often my teeth get sensitive to cold drinks. Thank heavens it is not all the time but when it happens I start brushing with Sensodyne toothpaste and it really works. It takes about a week or two but the sensitivity begins to diminish and eventually stops.  My dentist recommended this to me years ago and I always have some on hand. I don't have to use it all the time as my sensitivity does go away but if I had to use this toothpaste all the time I wouldn't mind. It works well, cleans my teeth properly and will freshen your mouth.\n\nI recommend this if you are having issues with cold or hot drinks!"
"4494","5","","B01CNT0L54","7d8c842432d5abc25373c88167bfcf2fWI7Q","cheap price."
"4496","5","","B01CNT01OU","dbe3d320faa3f66ae000d5ba309a80c0UCAD","Aquafresh Extreme Clean has been my go-to for years. It does not leave a weird aftertaste that some pastes do. Will continue to purchase."
"4497","5","","B01CNT01OU","56ab62575baad2d494e507855387f985N32A","This is my favorite tooth paste. It foams up so well and leaves your teeth feeling SO clean!! Great flavor too. :)"
"4499","4","","B01CNT1BAS","2053a63b87b00201548c16161a4aa243ELD3","works"
"4500","5","","B01CNT1BAS","8be6bc14c24363d06952d58b586e346cS9A1","Good quality; fair price; prompt shipment."
"4501","5","","B01CNT1BAS","ea0e79a2c107299de971275c6f11bd99ZES5","Works great!"
"4502","5","","B01CNT1BAS","3df08d012032b327f2295beeeed23f54XASB","work great!"
"4503","5","","B01CNT1BAS","96c90f0e7d52a40d3d6ddd54849eb270B4BC","Best product for cleaning that I have found so far"
"4504","3","","B01CNSZTFM","3df08d012032b327f2295beeeed23f54XASB","Not having the best of luck with them...sorry"
"4506","5","","B01COSDGIS","486501b36bae946549344e2331bede1fQ36M","As expected"
"4507","5","","B01COSDGIS","ca85676df6ce111575f8d4160878462cWEBS","Great"
"4508","5","","B01COSDGIS","e01567defa56e104673fd31885de47d61R0X","We liked this."
"4509","5","","B01COSDGIS","c3b7ab6f8a17ac68c0a579cfca498107WEII","Delicious. Good quality. A long time favorite."
"4510","4","","B01COSDGIS","264ca0dbacdda73b40e4c3e991ee706bZCBY","Tasty"
"4511","5","","B01COSLLSK","94bc80841e3e27cfc64f0373f18a1d715FTQ","This is without a doubt, one of the better tasting protein drinks that I have had.  I got the Strawberry, and the flavor was excellent.  I will continue to purchase these."
"4512","5","","B01COSLLSK","190ac4fcb03831bf39c8a928df09b6b5VCDE","Great product, fast shipping..."
"4513","4","","B01COSLLSK","af444a6b87c0408ca0148bd2c482a77f6KF3","My daughter is tube fed. This helped when I ran out of her nutrition. Tastes good too"
"4514","2","","B01COSK34S","0ee1972c047da5ef12a0256f90293cc5UGT9","not loving the taste of this"
"4515","5","","B01COSK34S","f79a1f5492490b7c7640d566e940f1a5H9IX","Love the taste. Great for when u need something but don't have the time to stop and eat."
"4516","4","","B01COSK34S","c31af3c56f13c930a1ac50353cf382d01AHT","this is very tasty and refreshing when chilled"
"4517","5","","B01COSQ7SE","bdf54b4eec0ca529f2ace3283569f891QFN5","great"
"4518","5","","B01COSQ7SE","a8a51c138feeaff264836f8bfc2b7d7a7N5R","Love this so flavorful"
"4519","5","","B01COSSK4S","2364efca9d1c2fe579d6f6a3bb51f100PRST","It's good on pancakes waffles and cornbread."
"4520","5","","B01COSSK4S","384cb93615d79ffcc34af1bec298cf9dI2HO","does wht it is supposed to do"
"4521","5","","B01COSSK4S","cea1cead08666197f2b2e45188f28727V5DE","very good"
"4522","4","","B01COSSK4S","41baa9f2d68092c0eb9b2da3794a11adHQJ5","Thought we would try this... Surprisingly, good flavor. The malted was a change we were not sure about, but after using a cpl times, we decided it makes an excellent change. We also will add sugar free fruit jams, heat up and we had a yummy extra breakfast."
"4524","5","","B01COSLNW4","69e1cbf511c38134a7ab3b1ab5e2a2ff2QDN","as expected"
"4526","5","","B01COSLNW4","88c67aacea313558bb4bfd83c0187990RMZ4","My son loves these and I feel better about him getting some nutrition as he's a picky eater.  Works well for on the go sports kids."
"4527","5","","B01COSLNW4","766106e513fa6cc5712989a32e57cc02QTML","Love these"
"4528","1","","B01COSK7AS","0c241a8288aaac9f51a54d480c82bc60VF0T","It came looking dirty and it taste really bad. The texture threw me off too. It\nwas thin like water and was just gross. Will not buy again."
"4529","3","","B01COSK7AS","0d358acd9ba2efdc68ccc53f05b3343bE02A","Doesn't taste great but doesn't have a soy aftertaste, either."
"4530","5","","B01COSK7AS","f79a1f5492490b7c7640d566e940f1a5H9IX","Love the taste and great for when you need a little something to hold you over"
"4531","5","","B01COSK7AS","dc8bd367442a39e199b8398b7d8df801PJV8","tastes great"
"4532","5","","B01COSL30Q","ce31290ca5c5df958bd33f49736d1defHNJ3","thanks"
"4533","5","","B01COSLPYU","67bfdf015febbe5cc766528b75983f5cC195","delicious ."
"4535","3","","B01COSLPYU","ab8ddc01d85f303289cd6fd2587a5c13OFDE","its is alright, guess I don't care much for the strawberry flavors"
"4536","5","","B01COSLPYU","7def79c00563b9bfecf73993ffa9d40bPIDJ","Great for my husband, who is not eating much but will drink this"
"4537","2","","B01COSLPYU","f999fd2810b03b915533f40a798438ef2ZJ0","Wow, these were bad. I've tried Slim Fast, Equate, and Atkins weight loss shakes. The special K brand is probably the worst of the four. Stick with Slim Fast or Equate."
"4538","5","","B01COSU2VM","fa09bf813176b50c91e5be9023ce6159VF75","Good product"
"4539","5","","B01COSU2VM","6b2be4c11e94ab43ba5db0f7eedfbc7c3XAE","Love the gum and love the holder for keeping in the car"
"4540","5","","B01COSU2VM","69e1cbf511c38134a7ab3b1ab5e2a2ff2QDN","as expected"
"4542","5","","B01COSTS6M","0711c9a6bd9a4960ce983054afa70714VCWA","Delicious!  Smooth, creamy and love the dark chocolate.  Just the right amount of salt."
"4543","5","","B01COSTS6M","795c4f12448fcdfcfa74c819e0633f57FRL3","I love chocolate. That said I will eat most but admit that Cadbury is one of my faves. This particular flavor is wonderful! If this combo of flavors is good to you, I HIGHLY suggest trying these. I doubt you would be disappointed."
"4544","3","","B01COSTS6M","d930656daad9ceea0c2a3670512e043dP8O1","Not really worth the money.  It's just OK tasting."
"4546","5","","B01COSM2C4","018e3243cdaf4dfc294c9eeafa165ab50RE2","Small box, rather purchase from grocery store."
"4547","5","","B01COSM2C4","dae94fcad1b8fd9a46cdcc856c8e3f187VQY","Husband really liked these."
"4548","5","","B01COSM2C4","7aa4ca14095f0e313d222a66c1eabe85834L","delicious"
"4550","5","","B01COSTKPQ","ae392fbd7439ab6fa6806e815377431dS2E2","These are good and great for the whole family. Good for on the go to"
"4551","5","","B01COSTKPQ","b219581a7d933f79215eb45ffab94f66BGDT","As advertised"
"4552","5","","B01COSTKPQ","fe536cf16a9f66d1143e9415dbc47182NRPG","delicious-- i'll buy more!"
"4553","1","","B01COSMU2G","1f93a866b35f6f21426dad23ccc230e5YH09","very salty"
"4554","5","","B01COSMU2G","f116190dc876b79fc23c1ec0f6043e41XWC3","Most delicious experience yet!!  Delightful  It's expensive but a perfect appetizer. Will reorder for sure."
"4555","5","","B01COSHFG2","17ca8494b0e3e8ae166ebb100b505591LCUF","Love Campbell's soup. Great taste"
"4557","5","","B01COSHFG2","5fada55c17b99a5ca8c6b25239d13326NOA0","Another great brand"
"4558","2","","B01COSHFG2","5a485f23965bf2321aaab3f8a2afbf97LHXO","Well, it sucked. It sucked bad. Real bad. On the suck o meter it hit a 10."
"4559","5","","B01COSHFG2","3018c6388e14d4c3dea79b538fa5ea6dXLC2","great product"
"4560","4","","B01COSHFG2","a6ad40f870c0fa8beb836eac5d29fe5fBPBH","Pretty much the same as the chicken and dumplings but a nice soup for a chilly day meal."
"4561","5","","B01COSHFG2","8bc525bb1aa8d01fb004c56230310e02JUDP","This is one of my favorite flavors.  I know I shouldn't, but I like the bits of pastry in the broth.  Plenty of carrots and the chicken looks like white meat."
"4562","5","","B01COSHFG2","ccdca5475f162410238b188ae82c4f30ATJS","AS ADVERTISED"
"4563","5","","B01COSTTUC","e5b02d792eed18858d119a74c2bb9dd0MZV4","Very addictive."
"4564","3","","B01COSTTUC","498256a6477ea2893fbc9b7e5b4713c0SS7U","I learned my lesson. Don't order chocolate off the Internet. It seems as though they melted at some point then got cold again. Only to melt again outside of my house. Stuck them in the freezer and they were a mess even frozen. Chocolate had a weird texture after all the melting and hardening."
"4565","5","","B01COSTTUC","ef5b6286fa189f71e833015326c9cf96LMGS","Delicious Cadbury dark chocolate with a smooth and cream mint center! Double delicious!"
"4567","5","","B01COSTOD4","8a0002c4cb947ef596f8847f85b30f52FYEO","What can I say, its chocolate, its toffee, its Cadbury, its totally yummy!"
"4568","5","","B01COSTOD4","8bc525bb1aa8d01fb004c56230310e02JUDP","So good"
"4569","5","","B01COSTOD4","67f82c8664de810e937f86e6031c7e193MS2","These are WAY too tasty for my own good :)"
"4570","5","2","B01COSTOD4","58870d736a16b3c6776696076c2ebce1DWLD","Soooooo good!!!!"
"4571","4","2","B01COSTOD4","af2389a26dd6f88ff379241c3665749b39YW","Deliscious"
"4572","4","2","B01COSTOD4","6012cf70931b0ae8eacfb35690a9578cK6YA","Tiny wrapped pieces but of good quality. Melt in your mouth chocolate with toffee pieces. Cadbury is good.  Didn't realize they sold to Hershey's; Cadbury's used to be an English company."
"4573","5","","B01CQQY8FI","601c0756e538ea1e6b2993a956fbe229Q1S1","Absolutely delicious!!"
"4575","5","","B01CQQYBLY","639d5b761123908d5cc54162be72c0b1VKDT","Like all the Bai products and Maui coconut is among my favorites.  Could it be that I love Hawaii?  Wish they would bring back the lemon."
"4576","5","","B01CQQYBLY","8b4b313c537c910db42561d4a8a708ccF3KZ","Delicious, good price"
"4577","5","","B01CQX9BIK","4a8df446c83812e4308d8dc4a5c233e3HUWQ","Product arrived on time and as described."
"4578","5","","B01CQX9BIK","2e0f2e2cca9fc8a026cbfd1bbd1502c6JHTL","I became hooked on the chocolate malt flavor from the variety pack, but didn't care for most of the other flavors as much.  (Vanilla and strawberry are cloyingly sweet, dark chocolate too much, milk chocolate was passable but lacked malt...)  Unfortunately, local stores don't carry just the chocolate malt flavor - Amazon to the rescue!\n\nI use this in two ways.  For people who need to gain weight or increase calorie consumption, I add it to a milkshake to flavor the shake.  Too strong?  Use half a packet instead of a full one.  For people who want to increase protein consumption and still consume less overall, this mixed into whole milk as a meal replacement keeps them full for longer and encourages less snacking.  (Again, it's an awfully strong flavor, so I use more than the recommended 8 ounces of milk, more like 16 and keep adding milk & mixing until it's gone... Perhaps a 2 meal replacement by the time I'm done.)\n\nEdit to add that I am not a trained medical professional, this is my experience with the product.  Another reviewer was gracious enough to give more information in a comment to this review.  However, my way works for me."
"4579","5","","B01CQX91PI","ef5b6286fa189f71e833015326c9cf96LMGS","Quick and easy prep for breakfast on the go. Tastes delicious too!"
"4580","5","","B01CQX91PI","0c581a1a1173c66fd694232f47ed2582O8Q7","item as described/better than described. Arrived on time. Would purchase again."
"4581","5","","B01CQX91PI","9d343b6ca45714859f115453d1f5e9a4IRLS","Good stuff."
"4582","5","","B01CQX91PI","a040c0f4c5c2b24c66131e2c367b40105TY3","I would love to give this 10 stars since you came out with dark chocolate."
"4583","5","","B01CQX989W","54f9e7834708369bd61bf568f7b9e7cdH0IQ","I love it. However, I don't think 13 grams of protein (that is counting the milk) is sufficient for breakfast. You would be far better off with Hi-Protein Ensure with 30 grams. (and $$$$$) This whole thing is an individual matter. And how much of anything you can shove down your throat.\nAnyways I like the stuff, just do not depend on it for complete nutrition."
"4586","5","","B01CQX99W8","c8c7277c57a852e0fad31389462e9759S0S5","These are good."
"4587","4","","B01CTRID50","0d5e496c71b572aedd287efabb6229d4JG1K","I originally got a small sample of this which came in a squeeze tube. I loved the way it restored my skin, which was really dry due to some prescription acne products. I was so frustrated to find that the full-size product only comes in a ""tub"" like this!\n\nI really dislike dipping my fingers into the little pot to scoop out product. And cream inevitably ends up under my fingernails, a waste of an expensive beauty product. (Yes, I know I could use little disposable beauty spatulas to dip the cream, but come on!) The sample tube was perfect, easy to dispense and no wasted cream."
"4588","4","","B01CTRID50","0492566bc5d5e385cb4a89338df2e907XSEV","Seems to be best face cream I have used to date."
"4589","5","","B01CTRID50","08ddbddb71752cc2b05d5cd3d15e5d6b0BGH","So soft and works well!!"
"4590","5","","B01CTRID50","5411c2b7f3e7dea4c462d834b073350c2JCZ","Always use the Aveeno face moisturizers. I get compliments on my skin all the time"
"4591","4","","B01CTROYAI","3fd0ecb305461ff3b3013aacdcfb83eaO0BX","love this product"
"4592","5","","B01CTROYAI","904ff563b95057f7e6c72b1633fac62aFWZD","The item was delivered on time and exactly as described."
"4593","5","","B01CTROYAI","a7b724eae622a9d3871d99ebf253fbfaSSVP","God I love this lotion it smells good I get compliments on how good it smells and it's subtle not too strong but the lotion is fantastic not greasy and it soaks into your skin and makes everything smooth"
"4594","4","","B01CTRH04K","cdbcd88eab1dce3fc4aa7e4a880abce9I8OW","What I was looking for!"
"4595","5","","B01CTRH04K","b6b4062ba5f6d5b7f745cd6ef9ce1a065S9S","smells great. great price for the size."
"4596","5","","B01CTRH04K","a53c60c941d8c5a0356b96400d807ea16245","Love dove products"
"4597","5","","B01CTZBT2Q","17cc49dc311dd765807295fa13cd91f0ELCK","Cascade Rinse Aid Platinum adds a nice shine. I use Cascade Platinum Dish washing pods and using Cascade Platinum Rinse Aid works great together in the dishwasher."
"4599","5","","B01CTZBT2Q","25246fe765e2b0f8c17a48e1226741442K1R","easy shipping and payment"
"4600","5","","B01CTZBT2Q","d84071935720a715ffb61f86350c8425KA43","Excellent rinse aid. Usually I use a short program without drying, but with this rinse aid my dishes are almost dry. Great result!"
"4602","5","","B01CTZCPB0","41b74951e4bea0cc950b9c5833949fb2RL7O","As expected"
"4603","5","","B01CTZCPB0","bd7c2848e3ed4bbf9a9b0e4e04d81ecbY7A4","Great for a quick sweep to get the dog hair up."
"4604","5","","B01CTZCPB0","28b81cdb734a145febbe68e3ad6fef17O6NS","My maid uses these at the end of her cleaning to pick up anything left behind after she mops. She loves these as I have a shedding dog that leaves a lot of hair. This is the one product my maid doesn't want me to run out of. Highly recommend."
"4605","5","","B01CTZCPB0","b228414f5532c58012442f362af42046ABA0","Love the disposableness of these Swiffer pads for someone who is allergic to dust and dust mites. They work great with a little Endust on them, not Pledge. Picks up dirt and dust. We always have tons in our house to keep it clean."
"4606","4","","B01CTZCKKQ","8b7612590eb2cfd2fd16a2d28a6a85deBR4J","It works fairly well, and I sometimes turn it over to use the opposite side."
"4607","5","","B01CTZCKKQ","82f107694ebe18613de9fbb9ce9514b8F62S","very useful!"
"4608","3","","B01CTZCKKQ","e71c68f7035d1fdfdadf4bea725071e82Y70","i got the wrong one"
"4609","5","","B01CTZCKKQ","735be20e27e2e0e970b863c8c0bfc5b5O10X","Great"
"4610","2","","B01CTZCKKQ","e5312d16c2a435dd4f51abb638238bb793SJ","Don't like the wet mopping pads.  Very drippy, time-consuming applying on swiffer wet mop. Will not buy again."
"4611","5","","B01CTZCFKQ","a4b8ae210dea9b2f2319337ce842ba03QDBY","love this scent"
"4612","5","","B01CTZCFKQ","58b32fd17fbb7850e64b7075be5f814dGC6U","My favorite."
"4613","5","","B01CTZCFKQ","4f0702b67ae4b0359bb1ebef1d89df47V8U1","red white and blue"
"4615","5","","B01CTZCU3I","f5a103f65680734feb2bc5a6b823a7a6L74Q","Great product."
"4616","5","","B01CTZD3QG","329d8736b61bc8e2213f3917eb885bb23CDW","works great for all types of floors expecially wooden floors basically off alliance against the dust-up collects the dust hair and all that works great just like it says it does"
"4617","5","","B01CTZD3QG","a58beace520a34ffceadf3a33c4cf1a5R4GO","We are a multi pet household. l use these all the time.  One sheet always does the job when I am ""swiffering"" the hardwood floor-- grabs a lot of pet hair and dust bunnies!  Thank goodness!"
"4618","5","","B01CTZD3QG","50f25ed92f9ca087974bfd63bf980c45QWS4","good"
"4620","5","","B01CTZD3QG","3e1435a919774457b46221db05569746SS48","I use these on a steam mop of another brand. Works just fine.  I find these better than washable types because of the pad texture.  I don't mop at all, I only steam clean (we have a lot of dogs), so I like the extra texture."
"4621","1","","B01CTZD3QG","e71c68f7035d1fdfdadf4bea725071e82Y70","don't like"
"4623","5","","B01CTZCYEI","e15f232d82c04384640f88f49492ceb5FT5B","I love them for dusting and cleaning my blinds."
"4624","5","","B01CTZCYEI","46019740d14712cdd50209e4ac6ffc3467ZP","helps clean the fans"
"4625","5","","B01CTZCYEI","270491c5a889ad13ffaf1bed60b15a5e3DXC","Good price. It was part of my Amazon Pantry order. Now I no longer have to go to the store and load up on toilet paper, paper towels, 4 pack of Clorox wipes, heavy cat litter and other bulking items. You simply order through Amazon Pantry, and let them do all the work.  One big box it delivered to your house. Cant get any easier."
"4626","5","","B01CTZCYEI","58b32fd17fbb7850e64b7075be5f814dGC6U","Love them"
"4628","5","","B01CTZCYEI","bd7c2848e3ed4bbf9a9b0e4e04d81ecbY7A4","Love this product."
"4629","5","","B01CTZD88O","790b0c55684a06157c7fa0934ea7dbbaXITE","I love my swiffer... And having all tile and laminate floors, keeping these in stock is a must at our house."
"4630","5","","B01CTZD88O","7f71ef4b7ad994260bf35def7799f17fJOM6","These work well on my hardwood floors."
"4631","5","","B01CTZD88O","fee516ed7cd5c47a0b46697a01cf08f708X7","works very good"
"4632","5","","B01CTZC4QQ","7ae63d14c427e0c85e8f56094895234ePGCH",""
"4633","5","","B01D16JAA0","151918c7cc20ae4e520c24b4fa5f589f5FWY","Darnit these are good. As if I needed another snack/chip to be addicted to. These are very good."
"4634","4","","B01D16JAA0","dd9f2812f77feb534121ec2cc9878fd6BJLG","Good Stuff"
"4635","5","","B01D16JAA0","39df80a759b565a9a769c6f2a33db523IPGM","Real flavor, not like the off brand junk from other brands."
"4636","5","","B01D16LKEO","54f9e7834708369bd61bf568f7b9e7cdH0IQ","These are exactly what your Grandma's molasses cookies tasted like, except mine's were crisp. Archway is a respected bakery, and these are good cookies with a cold glass of milk."
"4637","5","","B01D16LKEO","300e064f42cc48c0a29edb71a60989d3MVYM","pertect as expected"
"4638","5","","B01D16KKBS","7beb7e44d9e5303befc190929874272eBG4R","These cookies are one of my favorite! Love em!"
"4640","2","","B01D16KKBS","af4f51b91d3cd7cdebe48909f09cfb8dHE26","Not very lemony, weird texture.  Thought it would be a harder cookie."
"4641","5","","B01D16KKBS","d584ed09cd0caf68d679b6e01e4dfad02EBX","I love these cookies"
"4642","4","","B01D16KKBS","d3a6b1473283c224141232bebf86d95f70KA","very soft"
"4643","4","","B01D16IX6C","c72b54c770afb449346a9570efce251dZP5Z","I am assuming these were very good. I wouldn't know personally because I never got any of them. The price was good and they arrived in decent condition."
"4644","5","","B01D16IX6C","4e32844f494c45fb990fefb6fcb84d6eF37N","Very tasty."
"4646","5","","B01D16IX6C","b724d57b4e561008cbc6e686e58fcfe9IMI5","These are my sister favorites. I got a great deal on these too."
"4647","5","","B01D16IX6C","653713f751b107e94ee7913d780c5fb2DYR5","This is my husbands favorite Crackers!"
"4648","5","","B01D16IX6C","e4d4be8d0f532a62b199562615fd0dba0NWH","You can't beat the taste of Lance. Very good crackers."
"4649","5","","B01D16KUL8","0a1c5091db698a235cece1d721912e16RR21","Enjoyed!"
"4650","4","","B01D16KUL8","c7093677c4af6a863b66de476c74ac7eLPGA","Tasty and affordable."
"4651","5","","B01D16JNK2","896dc4fa3784c08d05eb4d3cef6916a2M2GP","Tasty snack small pack."
"4653","5","","B01D16LTBS","300e064f42cc48c0a29edb71a60989d3MVYM","pertect as expected"
"4654","5","","B01D16LTBS","0a1c5091db698a235cece1d721912e16RR21","I love these cookies!"
"4655","5","","B01D16LTBS","934e9965d7c1eb83fcacc144f1b835d553OC","YAHOO ARCHWAY IS BACK!"
"4656","5","","B01D16LTBS","5095d2bb2db63fb8f08f7472f641775882P8","Good cookies."
"4657","2","","B01D16LTBS","a1e510ebe470da6b9772a6c440df2e1aGK6P","The cookies I received we're all stuck together and hard to separate and the name raisins and oatmeal needs to be changed to just oatmeal there was about three raisins on average per cookie they were dry and had a heavy Taste of molasses not oatmeal\n I give them a rating of 2"
"4658","4","","B01D16K1AS","e8e127cab55fadebf76e03dc0ec3c40aC246","good"
"4659","5","","B01D16K1AS","ed2ff5d628e445ad1f35a5b995db4a7eF0II","For ginger lovers only"
"4660","5","","B01D16K1AS","0a1c5091db698a235cece1d721912e16RR21","I love Gingersnaps!  Satisfied customer!"
"4661","1","","B01D16II2G","193307ad4a42753c01746a672b2a7f0cU79X","Arrived as mini chips"
"4662","5","","B01D16II2G","5c6319b94417b9b5707660bc4126f5782JLU","Great taste and not as hard as some kettle chips are."
"4663","5","","B01D16II2G","39df80a759b565a9a769c6f2a33db523IPGM","Real flavor, not like the off brand junk from other brands."
"4664","5","","B01D16II2G","8aa66a67017c67a68fc37c96876c767bNQIH","Marvelous"
"4665","3","","B01D16II2G","363ea6c515b261b12144668b4fc5b9e4SIKY","Didn't like these too much. Not great potato flavor."
"4666","5","","B01D16LP0I","300e064f42cc48c0a29edb71a60989d3MVYM","pertect as expected"
"4667","4","","B01D16LP0I","b0ea8f5f876caa3405ef9d6f6f73dfc1N6TV","Yum love these. Buy again and again"
"4668","5","","B01D16V2LK","91cbee3e7df03b8228bf9be277239c3d9A4X","Reasonable prices"
"4669","5","","B01D16V2LK","300e064f42cc48c0a29edb71a60989d3MVYM","pertect as expected"
"4670","1","","B01D16V2LK","ad7cc90e5f515a410f37166cc360fd1911XJ","These were all stuck together and not what wanted."
"4671","5","","B01D16V2LK","5095d2bb2db63fb8f08f7472f641775882P8","Soft, tasty cookies!"
"4672","5","","B01D16KPL8","509e5861ef4b163b7f8e2b9b2b3c2bebUAKP","Exactly as described!"
"4673","5","","B01D1B2J6C","1a0bf8f141a67808f5d31a410576f155X8UL","I love these beads they leave all of the clothes smelling great for weeks."
"4674","4","","B01D1B2J6C","792d161b9035f6a217386ae41dd04fb7WDHP","I cant wash a load without them. Clothes stay fresh even when I leave them in the washing machine for a day or two."
"4675","5","","B01D1B2J6C","33f0531b63a6a8bfae0c9ba4b35fd435AB8O","I love this and I really love that it smells just like the ""Glow"" that P & G Unstoppables discontinued.  I'm so glad.  It was my all time favorite!  I've bought a whole stash just in case something happens to this one.  I can only hope that it will be popular with many people.  It's so much nicer than the super strong smells like some are."
"4676","5","","B01D4G9UFM","081720fe185be4b29f015315a761b47eG4PP","I always wondered why All Dressed were never available in the states and now I am happy that they're here now. They're my favorite favor of chip. You also can't eat too many of them in one sitting since the vinegar starts to become a tad strong unless you're having them with other food like a sandwich. If you try them they'll grow on you."
"4677","4","","B01D4G9UFM","bcb38bff6411beb7210ddb11d87f6f144WS8","Grwat xhips. Very flavorfull.. just don't buy them all the time or you get bored of them"
"4678","3","","B01D4GA2FY","98b029a55f9d8fccb1f09e44460a40674X76","It grows on you.  Good for just snacking mindlessly but I probably won't buy again."
"4679","5","","B01D4GA2FY","4eb8eb654f478f2a671ea3773ee5b2a40UTF","Tasty!"
"4680","1","","B01D4GA2FY","028eb791ce5bb187c81ce1a3d9bd399087ID","This popcorn tastes like a rice cake with a bad after taste. I know to get flavor and fewer calories something needs to give but I could not finish the bag. My kids wouldn't eat it either and they love popcorn."
"4681","1","","B01D4GASO4","542b29aed1a372cd9cb6bff9dda3b408BEKH","These chips are normally pretty good . At least the other flavors Ive tried. These were lackluster and not as flavorful. But what I didn't like most , about these chips is that they were all crumbs minus the few I ate this whole bag was crumbs broken chips. Very disappointing . I gave them away ."
"4682","5","","B01D4GASO4","a2431a137d18db9d4c5c978cc358e6c6WGZI","Terrific taste great with my after glass of wine. Crunchy. Will buy again."
"4683","5","","B01D4GAV5A","ef9a612ef8f5936ad19de4dbe464ec85057Z","Excellent product, quick shipping!"
"4684","5","","B01D4GAV5A","56e41c7b1fcdd90cf1fb2368cae65958V5HY","Compares to Doritos."
"4685","5","","B01D4GAV5A","e302eddae1fb339e0bad35f4e7ffcb0dF9ME","I received the product as seen and I was pleased with my shipment. Thank you"
"4686","5","","B01D4GAV5A","9099bef7633e7175d8d8d81737e75ac6LS5P","Came fresh and undamaged"
"4687","4","","B01D4GA0QA","fd57d89b9751ed5f854ccd1078dad9aeBXBD","ok"
"4688","5","","B01D4GA0QA","b82b03da9571894b4f45d1468c093531QGBG","This are super addictive - I ended up eating half the bag in one sitting....and I bought a new bag at the grocery store because I didn't have enough items to justify a new Pantry order. Theyll be a staple from now on!"
"4689","5","","B01D4GA0QA","f28e244bd2c34e46232c4af08e4db798YGUC","Great flavor"
"4691","5","","B01D4G9SCM","cec7fada034e23d6562f7e410bb811e0JBHU","Love this popcorn. Flavor is delicious."
