"id","rating","vote","asin","user_id","reviewText"
"1418","4","","B015GK15WA","69daeaaab2ab5999b81038061032211dG3H0","These were pretty tasty, though still not as good as Planters. But, they surpassed Planters in the variety of nuts included in the bag. Sometimes, Planters has too many peanuts in their mixed nuts & not enough of the better nuts. These have several types of nuts & plenty of each. I'd probably buy them again. What I really liked was the tropical trail mix I bought! That is addicting! They came quickly, were well packaged, & the seller was great!"
"1419","3","","B015GK15WA","fa76b2f26e1f81bd7133f850b821285bUMYF","After trying other nuts by Happy Belly I kinda looked forward to eating the mixed nuts.\nSomehow a couple of not so good were the first I tasted.\nDisappointed I closed the bag and put it away.\nA couple of days later I tried again and was very happy.\nI just got a few bad nuts that almost kept me from buying Happy Belly.\nIt could have been me.  Perhaps I'd eaten something earlier that didn't go well with nuts."
"1420","4","","B015GK13QS","6365bce77cfe53c8a956887b5573b9caJBVC","nice quality walnuts, just wish the price would have stayed low."
"1421","5","","B015GK13QS","57d5686df87ad421357c36edeaacc7d451DG","Perfect."
"1422","5","","B015GK13QS","65387dc0aa823f483812503de41c5605QMT9","great nuts wanted to purchase more, but were recalled, loved this item. would buy again if available"
"1423","4","","B015GK13QS","f99f1d142c1cb69e826aae81a2ca5d9fJSWI","Walnuts, great for you and can be added to almost anything."
"1425","5","","B015GK10KW","eb372a0cff1bc59ad625d55a1298dfdf8OT3","Good value. Taste great = crunchy, salty. I would definitely buy again."
"1426","4","","B015GK10KW","995e8909c439b73650834fcb80d43bcd35W4","These nuts are good. I wouldn't say ""oh my god you have to hAve these."" But they work for when I'm hungry at work and all I have are these nuts."
"1427","1","","B015IO2VFY","a8dd36cf849bdc279288541f2a67cdc81DPP","Dont buy this unless you want your stomach and ass to burn"
"1428","5","","B015IO2VFY","39e1da4a15bb4944914be72a05aee605Y6OI","Great Taste"
"1429","2","","B015IO2VFY","4ddcb9fed6affc1661dccbf4ed120ee5JEU6","not very good."
"1430","1","","B015IO2VFY","1f7da5d152954e63d75ed6984407f131F1TM","This stuff is gross in my opinion."
"1432","4","","B015IO2D5M","9828b32b60b29f96dbac45716560f6b5DDJ8","good"
"1433","5","","B015IO2D5M","22a9cb3c18c1091af92d5b5c8bd937b4YEQE","This was so good I ate it room temp..."
"1434","5","","B015IO2D5M","31cb79342c8e2727eb98c96ab76898087HMI","on time & as promised"
"1435","4","","B015IO31U8","7dd4b76fe98a7fe64aec212e5ef94a35ST8E","Food tasted great, but my cans were all dented when they got here and it made it difficult to open the cans"
"1436","4","","B015IO31U8","83824a31ac1084c89d1851193ade20707E2D","Used this in Cheesy Tuna Helper and tastes good."
"1437","1","","B015IO31U8","17e55719ea6be98ffbbcf5c9f1da9aa0VPE1","It might be great, I don't know because all three cans were so **badly** dented I wouldn't use them. I mix canned chicken with my foster dogs food when I run out of real chicken. She loves chicken, but these cans went in a garbage. Amazon, seriously no dented cans please!!!"
"1438","3","","B015IO31U8","d631b529dbbac4e6c5db149c7661fa8257W1","Actually pretty decent chicken to come from a can."
"1439","5","","B015IO31U8","5d89f169dbc9b870c4f6b60f95c7f6306EJ9","Tender, tasty, not excessively salty, though not for a low-sodium diet."
"1440","5","","B015IO31U8","c37ac6b9eb095202937108401aff03d35BK7","very good"
"1441","5","","B015IO31U8","fef5971a531d800d099ffa064dcb9e11CLLH","love this have gotten it several times"
"1442","4","","B015IO31U8","ca5e145d2c4074a9ab4ab92e72cc9c255DHB","like"
"1443","4","3","B015IO2YB0","84e8395537eb70e25f128fb8b39e16acMCES","There's definitely a smoky flavor added to this chicken, but it's not overwhelming like the ""smoke"" added to a BK Whopper. I use this often for a casserole for two, or chicken salad for two. If you like this product's regular flavor, then you're likely to enjoy switching up with this on occasion. I plan to make chicken burritos this week using Ortega taco mix to season the chicken. I would prefer quesadillas, but I only have liquid cheese food in the kitchen. (Frito Lay in the can. Bought what I could from Amazon on a painful budget. AMFresh still doesn't deliver in my area, so I live off pantry since I am housebound now and unable to get out to a grocery store.) Will edit review when I see how it goes. Also plan to make chicken pasta salad for lunch using Suddenly Salad by Betty Crocker (fiesta flavor?). Will let you know if the smoke flavoring gets in the way. I say flavoring because I highly doubt this ""meat"" has actually been smoked. Just my uninformed opinion. Of course, I miss my Dad's smoked chicken, but the old days are gone. Hopefully, I can make recipes that will force my brain to think it's the real thing.\n\nBut let's be honest, the texture of Swanson's can chicken is suspect at best. It's one of those items you just scarf down underneath a ton of spices and hope your body doesn't hate you later. That said, it makes a great chicken curry over rice if you're not obsessed with food texture. It breaks up easily. But when it doesn't, you get a mouthful of ""chicken"" that doesn't have the right mouth feel along with a very processed flavor. Beggars can't be choosers. It's the best canned chix on the market that I've tried.\n\nI'd rather eat saitan, but Amz doesn't carry it in pantry yet. THAT should say something about my feelings regarding this chicken's texture. And still, I've had worse. Much worse.\n\nFor now, go Swanson's or go home."
"1444","5","","B015IO2YB0","76baa17e35bce6fb3b8f1628ce5c766cHSAM","I love to make my own chicken salad and the Swanson makes it so easy and fast.  I really couldn't tell the difference between your regular chicken breast and the grilled,  to me they are both great.  Thanks for a very good quality chicken product,  I eat  chicken a lot so this is important  to me.."
"1445","1","2","B015IO2YB0","cabd9f017069368a5ea6c8c0c5363eeaYLD3","Bent cans damaged with broken glass and picked juices"
"1446","4","","B015IO2YB0","1fc4dbaed56d6dbc9e95c0da989a6740WKYU","ITS GOOD"
"1451","5","","B015IOABMY","aa5078fa7cd80e95fa4e9f667631a72cACYX","One of my favorites. Delicious and a good pick me up in the afternoon"
"1452","5","","B015IOABMY","783e2861e7ad57067b4533131101fde64C55","Tastes great and furnishes one serving of fruits and veggies. Says so right on the environmentally unfriendly plastic wrapper employing the important job of holding the six cans together. I really appreciate the fact the caffeine comes from green tea, though I don't know why as all caffeine, whether synthetic or natural, is identical."
"1453","3","","B015IO2RKS","c6bf0c1037b37b06be2a0524658e5cd7CP2L","Smaller than I expected.  Good taste but not as good as the regular can kind."
"1454","2","","B015IO2RKS","331a24a73dbb6ba00c39499834b5bbc37F15","Lacked flavor"
"1455","5","","B015IO2RKS","10fb2431281996f6027d463f7c8cdfe7OB0X","godo"
"1456","5","","B015IO2RKS","ff07e4643a1d5bb448d09a8cf8bd62fdPPG8","very good"
"1458","5","","B015IO2JR4","6cbfbee3f4de0056f16e2fb0be584579DC1K","Rich and satisfying"
"1459","5","","B015IO2JR4","1cf4d03c1be358423e4d67d65a820c3c5OI4","delish"
"1460","5","","B015IO2JR4","9e596ace685722461083ba8929d9555cNL7S","Wholesome soup"
"1461","5","","B015IP43MW","193307ad4a42753c01746a672b2a7f0cU79X","EXCELLENT"
"1462","5","","B015IP43MW","bdf54b4eec0ca529f2ace3283569f891QFN5","great"
"1463","5","","B015IO2NO8","8ede1bb07b80126b11f6bc7c4445c3a6RHYI","Good tasting!"
"1464","5","","B015IO2NO8","c5388a22e9163f5b229d02775e93aec16WRY","I just love this hot chil."
"1465","5","","B015IO2NO8","0ad68877e78721bd7a1ec39ecda93395ZV1B","The very best hot chili on the market."
"1466","5","","B015IO2NO8","96ec3429120116528b230a0c16e67b80IZQ7","Not eaten yet.."
"1467","5","","B015IPI78S","20477098b83fbcaf2e26485a3f49dc79NYB5","I prefer foam soap to bars."
"1469","5","","B015IUI5X0","bfdadc4cda0cf234b65a7a012354fe7cLZPC","My dog ask for it now when hips hurt"
"1470","4","","B015IUI5X0","e46ac958b66174f23f88343e8189a753B9HJ","Don't know how well they really work, my dog isn't talking and she still limps"
"1471","5","","B015MJAPGM","f0f1a506c849f1153488a2745e03b5dbQRZZ","Very effective & does exactly what it is designed to do. My dog is happy that he can now roll around in the grass without the discomfort of unwanted hitchhikers latching onto his fur copping an unpaid for meal."
"1472","1","","B015MJAPGM","ef58e6059b3a18ae6b4652e9d3188077Q85D","useless."
"1473","1","","B015MJAPGM","b47bec781f5205b078c57a0b3026bfef737C","This was scary! I went on line after ordering (I should have done it before ordering) and the active ingredient is not ok. Research carefully before buying. I threw it away."
"1474","5","","B015MJUHBU","8fca5ee929b48015e751b42223420674BD6T","When I bought this mid-November, I was heading off on a vacation, and didn't have a chance to try this till after Thanksgiving, actually in December.  When I purchased this, it was $3.91 for the bucket of 3, I thought that is a great deal so I got one, and enticed I also picked up the Cheddar Cheese, which has it's own review elsewhere in the Amazon products review.  Suffice it to say this was more smoky than ""bacon"", which was okay and less maple than brown sugar, also okay.  The mixing process a little messy, but I'm grateful for the bucket which helps to shake it better than you'd be able to in an open bowl.  The popcorn pkg is enough to fill the bucket, the ""buttery"" liquid followed by the powdered flavoring make for quick work even tho a little messy but it's part of the fun, right which of course you'll want to wash your hands before you ge them greasy again, but you're going to handle the remote unless you have voice control?  Lol, this flavor is really good and I'd buy it again. but NOT for the prices they cite as of this writing which is over $10 for to other flavors in which I've no interested.  I'd pay $5 but after that I can make my own, hey I've got the buckets and I'm making Hawaiian-style Hurricane Popcorn which is much tastier anyway."
"1475","1","","B015MJUHBU","3165dab69ba23a61b61b3b9bff46e651EUCX","It didn't taste like maple bacon at all. The brown sugar just went to the bottom."
"1476","4","","B015MJUHBU","d75dae90a8c3316a835c35f64c21fe16S9M0","The truth is that I didn't want this flavor, I wanted butter flavor.  But, after reading the description, I realized that it IS butter popcorn with the maple bacon flavor packed separately.  So, I ordered multiple units at the heavily discounted price at the time.  I cannot comment on the maple flavoring, but eating it as butter popcorn - it is great.  It is a very nice butter flavor in a packet that lets you control the application.  The popcorn itself pops completely and is unusually tender and ""low kernel"".  It does not stick in the teeth nearly as bad as other brands; it is even better than some of the ""hull free"" brands.  The only reason that I took off a star, is that the regular, replacement, price is WAY too high for three very small bags of popcorn.  It is consistent in price, or cheaper, than the Pine Valley website, so it is not Amazon's fault.  It is just that $5 to or more per tiny pack of popcorn is insane!  Sadly, I won't reorder unless the price goes way back down again."
"1477","4","","B015MJUHBU","62132880b4690476eb97cfe8a682c1d05ES7","My husband loves this flavor.  It is sweet and salty at the same time.  Would purchase again."
"1478","2","","B015MJUB6G","8fca5ee929b48015e751b42223420674BD6T","If you like it this salty, you may want to keep company with a salt-lick.  I paid $4.15 so it was worth trying, very much like the Maple Bacon, which I got for $3.91.  I tossed the salty cheezey mix out and using the ""buttery"" liquid after popping, sprinkled Japanese Furikake, for some Hawaiian-style Hurricane Popcorn which went over very well."
"1480","5","","B015MJUB6G","83b0d54158895b6437c4f0da74368630XDNV","Best cheddar popcorn by far - tastes similar, if not better than, fair popcorn!  So good!"
"1481","2","2","B015MJUB6G","db61451e82d7ee81c7e9b7dc469ceaf4ZOWA","Alright, when I first ordered this product it was through prime pantry and priced at $1.50 per container.  Turns out that was a special sales price, and although I thoroughly enjoyed the popcorn, which is quite delicious and easy to make; it's still just popcorn not steak!  It's now selling for $17.23 per container.  Sorry Pine Valley Foods and Amazon, while it's nicely packaged and convenient to make, and very tasty to boot, it's still just popcorn!"
"1482","3","","B015MJUB6G","c4ddae934937dd4875eb0783ca6fd7caYGI5","The popcorn and oil is good. The cheese powder is not.\nThe cheese is just too much, too potent. It does not get mixed in good enough. I didn't care for it and threw the other 2 packets of cheese powder away and just ate the popcorn with the buttery oil- tastes like movie theater popcorn!\nLove the packaging! Makes a great gift."
"1483","1","","B015MJBYX0","9e3662128f7910c4e53dcbed66365c38QWKA","Made my dog sick.  Not a fluke.  It has happened before.  Bad stuff."
"1484","5","","B015MJBYX0","956d818068e3c7cd1b984f75192cf260J79A","My dog loved it, not sure but it seemed like good ingredients."
"1485","1","","B015MJBYX0","95936b66715b743c5559480af03a5453V1ZI","My dog looked at his bowl and wouldn't even sniff it!"
"1486","4","","B015MJU74C","67f23c3df4abf6ac2c1a686be090e45eZNRF","The item was exactly as described and came to me on time. I'd recommend this."
"1487","3","","B015MJU74C","820000760e06ae5bae77f89b92455ee32HG4","I really liked their maple flavor. This original, the butter type substance is ok  The popcorn cooked perfectly and tastes good. What ruined it is the powder substance they give you to put on it. It doesn't distribute well and it was nasty - too salty and powdery and I am not even sure what it's supposed to be."
"1488","4","","B015MJU74C","a57f9c5695ad44039ddb422e4f29f1f6P9Y7","movie theater flavor with the butter. maple bacon ....ew was not good not even kids liked it... but i would buy the butter flavor again if it wasn't more expensive than going to the movies and buying popcorn!!! GEEZ !!! 18 bucks for popcorn GET OUTTA HERE not worth that ...sorry!"
"1489","4","","B015MLL7ZI","3653f7aa08e760cb861fb4d73a8358acY3NE","good"
"1490","5","","B015MLL7ZI","9e6d5a2c96dfd4701781d3936ea9e98fBO9E","I was not sure at first...but fell in love with these crackers."
"1492","4","","B015MLKOUM","3653f7aa08e760cb861fb4d73a8358acY3NE","good"
"1493","1","","B015MLKOUM","7abd170d7be6d4c6f7d0732921b68cf4R32P","Nasty old taste."
"1495","2","","B015MLLBI6","8c6fc12ff6dca4c1416eacff050e4c01TZLL","its like eating dirt and seeds, super hard and not easy to chew.  They are healthy so theres that"
"1496","1","","B015MLLBI6","1f7da5d152954e63d75ed6984407f131F1TM","You know when healthy food tastes like health food? That's these crackers."
"1497","5","","B015MLLBI6","9e6d5a2c96dfd4701781d3936ea9e98fBO9E","I was not sure at first...but fell in love with these crackers."
"1498","5","","B015MLLHI0","e64471a62b89a0d146444a93bd5428d37VPE","Yummy and all gone, get some"
"1499","3","","B015MLLHI0","58870d736a16b3c6776696076c2ebce1DWLD","Very hard cookie (was hoping for softer version)...almost on stale texture."
"1500","3","","B015MLLHI0","a8eba56c90666014191afde132bbb642Q1M8","Flavor was good but I have always expected Ginger Snaps to have a crunchy texture.  These were too soft to be Snaps."
"1501","5","","B015MLLHI0","805eb23439ad81d4d4f66b005574307e8MQH","as expected"
"1502","5","","B015NNQU9I","93a875db83cde53ea56eba798417e5edCINL","very good taste-- low acid"
"1503","5","","B015NNQJJO","44864ccf5789a112842878efbbbc325cQ2ZI","Really good beans"
"1505","3","","B015NNQJJO","7aee25aea8c89a644795f114765dabf6R3ST","Okay but not great. Unlike the Starbucks Espresso, it doesnt make a superior latte. On the other hand, you're not drinking pesticides, and no peasants were exploited to make your drink. Good for you and tastes a bit like it."
"1506","5","","B015NNQRWI","1469ba25fe2b1ea5790bd785f655bd962WEE","Best coffee ever!!!! I am soooooooo happy to have found a great-tasting, organic coffee!!!"
"1507","3","","B015NNQH64","723af08f1dcaa56fce5a85f8b489957bWECK","Very weak coffee, but drinkable"
"1508","5","","B015NNQH64","1ef1b3fa61bd7dedeb9b408ac1c96d45DG9U","I make my coffee using a Melitta No. 6 Cone Coffee Filter. When I try a new coffee, I often have to experiment a few times in order to determine the right amount of coffee to put in the filter. In the case of this coffee, about two tablespoons were about right to make a pot.\n\nThe resulting coffee has excellent taste. The coffee has real coffee taste, which I like, but no bitterness. I tried it black and also with milk. Either way was good. It is also to the credit of the coffee that it is fair trade."
"1509","5","","B015NNQDV8","76dacd6a8ed170f38cf8cfbcf75b803dNAOX","great"
"1510","4","","B015NNQDV8","34172b74604f0caada43a864974930bdBCN6","Not quite as tasty as the espresso roast, but still very good. We bought this to change things up a bit... but still bought a bag of the espresso. They were actually pretty nice mixed together (when we got to the end of the French and there weren't quite enough beans left to make both espresso)."
"1511","3","","B015NNQPKM","fd2e8a19a78b4369a2b61ede61db44d8EZHZ","Thought this was going to be a lot tastier than it was."
"1512","4","","B015NNQPKM","63a959f13c4013897122b0f238bf116039O4","better than average coffee."
"1513","5","","B015NNQNAE","21b94cf6220d612f4d0c5cad1f8cf15eELOR","This is gorgeous coffee. Rich, finely ground, excellent."
"1514","4","","B015NNQ6UG","3dc1cf6cf8bb7daf45acf79c186224c0G1D8","I make single-serving coffee, generally, and this is a very smooth cup, enough bitter to make you remember you're drinking coffee but just a really good taste. (I like medium roast, and this tasts great!)"
"1516","5","","B015O4YQM4","35ad1cedd6e68d27daae0d6a11858aa5HUEO","Works so well"
"1517","5","","B015O4YQM4","89489608048932ea475b346e9d96c7cbYALB","my favorite"
"1518","5","","B015O4YMIC","a31583d033ad3184c15714cf3b232c077MWB","Smells so good! And works like deodorant should"
"1519","5","","B015O4YMIC","3eb51a297a038b4144ac4dde6c597deb8MUS","I WILL ALWAYS USE THIS PRODUCT, I LIKE THE WAY IT SMELLED ON ME, EASY TO TURN."
"1521","5","","B015O4YMIC","f8d3090d3f0afb20fc1e72b3470f3e4aAYVY","It works well for me."
"1522","5","","B015O4YMIC","6d7b224fb348a2c462e803637f339e4b05J5","First time trying this deodorant. We have been using it since. Good deodorant"
"1523","5","","B015O4YMIC","641e4101f399fddfe5f14d96a67d7f86048B","Makes my armpits get less stinky. 100% recommend."
"1524","5","","B015O4YUNE","80e3ddbba236192f8f5af268eae43e7e1C1B","As advertised, quick delivery"
"1525","5","","B015O4YUNE","cf163f315b4cb023d8e5ef9d5a8575821F60","great"
"1527","5","","B015O4YI40","7726fc5ac7c338e42157a01bd146d414UHQ0","Worked perfectly."
"1528","5","","B015O4YI40","bebbe6cefcf8595f51c66462c9be7ecaLEBK","My teenage daughter loves this stuff.  I am disappointed that it is no longer in the Prime Pantry.  Not only does it work well, but it was gentle on her skin."
"1529","5","","B015O4Z8GC","96f370d9c1c5b7410b0d1cccc2151455FUHY","great"
"1530","5","","B015O4Z8GC","fceb4243ccca40425eff4a4936615166Y7VZ","Great #Pantry addition."
"1531","5","","B015O6UM3O","1ddc5968e4e616ee10923a2659f7f861CWP2","OMG SO crunchy!  You gotta try these!  Very fresh.  Just the right amount of salt.  Not too salty like most chips.  Good flavor yet not overly flavorful.  My new favorite chip."
"1532","5","","B015O6UM3O","2e0f2e2cca9fc8a026cbfd1bbd1502c6JHTL","The only thing wrong with this item is that I didn't get the bigger size - but there was a reason, I thought two smaller bags would stay fresher.\n\nI've been hooked on these since I found them at a local store, so when trying Prime Pantry for the first time, adding a bag or two was a no brainer.  They're crunchy, a bit salty without being too salty, and go well with so many other foods - summer sausage, hummus, peanut butter, or cheese are favorites around here.\n\nI'm somewhat amazed that even during shipping, the bag had more intact chips than those purchased locally and carried home lovingly before ripping into it and eating them all in a night..."
"1533","4","","B015O6UM3O","7c194e5ce8a43725f8ed513672573a58LK0H","These are good."
"1534","5","","B015O6UM3O","1cf4d03c1be358423e4d67d65a820c3c5OI4","Greetings; awoke to items on door step,..got this for my kids,they devoured,with breakfast...great packaging...see you next time ;and have a wonderfull day.."
"1535","5","","B015O6UI1K","fc8e7dc750815fd8a72b2df227ff628eRY9K","Love this. Great snack or when you're craving something sweet. Great taste. Not overly sweet but just perfect sweetness and cinnamon."
"1536","3","","B015O6UI1K","6d406799cf36cd7097d289ee12307ddaOIFU","Tasty, but hard to chew! There also isn't much in the bag, but that's typical nowadays."
"1537","5","","B015O6PSO2","4143d816f2dd4a501dcc584b3cbf1e9bAF0D","Chips"
"1538","5","","B015O6PSO2","bac1fc0fc624d5442c655bb895b009caKWXV","Great price and shipping was so good the chips are all intact! Nice! All my favorites and my husbands too so we can share. Just the right amount for our snack or lunches! Thanks for shipping this so delicately . Very fresh also!"
"1539","5","","B015O6PSO2","7cbafa3ff89dcc79cb100b7d4801ce8eV97Z","Great variety. I love Funyuns so I was happy to see them included in this mix."
"1540","4","","B015O6PSO2","c9defbbf3b4f69819c3373008a237650BAMU","bought this product for staff and of course they liked it."
"1541","5","","B015O6UBIA","1ddc5968e4e616ee10923a2659f7f861CWP2","My new favorite chip!  Extra crunchy/crispy.  Good flavor.  Stands up to any dip.  Great with hummus, cream cheese spreads/balls.  Nice thick chip.  Super fresh.  Not too salty."
"1542","5","","B015O6UBIA","c57456059ee5cde76399eb5d114878ddBRKL","We love these!"
"1543","5","","B015O6UBIA","693aa9d4e8d386b92c8ce36aaa39f70a457G","These chips are favorites - they do not disappoint!"
"1544","5","","B015O6UIOW","9645957223abdb398e4171134f8b95a2PQG6","Delicious, not too salty.  Can be difficult to find.  Buy it in the 12 pack case at Prime Pantry prices when available.  I like New York Bagel Chips with everything better but they are almost always impossible to find."
"1545","2","","B015O6UIOW","1031440aa4a2acfe836a51ee21bacab99AJ8","Very, very hard not crunchy. Won't buy again. Could chip a tooth it is that hard."
"1546","5","","B015O6UIOW","854a9d8ae5ed073e0256f0251738e4311KJZ","great flavor"
"1548","5","","B015O6UIOW","3327d4a055dee03ac4b47ecd1badebd7C5TY","This is a great snack.  Very flavorful on its own, but great with dips too."
"1550","5","","B015OE7HWK","bbb71e90df5e4ce6420f998a9e60ddf73A0L","Yummy"
"1551","4","","B015OE7HWK","843497bd900c0aa32e0c43b625784df47P45","good taste"
"1552","5","","B015OE7HWK","dcfcdf37cbe61d53b3aac4292b6ac1c16NCV","Good way to have a treat and still have something ""good for you."" If you like dark chocolate and cranberries, you will like these. (I do.)"
"1553","5","","B015OE7HWK","f0bf09d8c3620ef63c97457fac2e2c54PD68","I'm obsessed with this snack. It is the perfect size and taste really good. It does have a lot of sugar, but I always crave for something sweet. It has 11 grams per bar. Nevertheless, I though it was much more, because after eating it, I don't wanna eat other sweet for the entire day."
"1554","5","","B015T22TYS","7daac4d30115ff6f2a1e45a77680f64eECX5","SPICEY Wonderful V8 Vegetable Juice is\nSUCH a Huge improvement over Regular\nV8 Juice that it's almost Impossible to\nDescribe !\nRegular V8 always reminds Me of Tomato\nJuice with Celery flavoring, Bland, Unappealing,  Blas !\nThis Stuff will Bring Tears if You're not accustomed to Slightly Hot & Spicey Juices !\n\nVERY GOOD STUFF !"
"1555","5","","B015T22TYS","1b3446c73e14952bad4d3aba1e5101f7HQAR","This ia a great size for juice for a single person.  I love both the flavor and the spicy heat, and V8 is a very healthy drink."
"1556","5","","B015T22TYS","befa36bf038152136d713b0b94462f89DHJA","it was really good will buy it again"
"1557","5","","B015TYE016","f77058643e5cff7e3fbe9947b1c53ebf6P7L","Great value and very absorbent."
"1558","5","","B015TYE016","18b0132054620bb27d10653ff04074b0I30T","The best"
"1559","5","","B015TYE016","6ca05f7495cb0b048589cdf010ced8981I4T","Its Bounty, its paper towels..."
"1560","5","","B015TYDZTE","4143d816f2dd4a501dcc584b3cbf1e9bAF0D","Paper towels"
"1562","5","","B015TYDZTE","90669d7760ebf0961f18b2740f4bcbdcR8ZP","Works as expected"
"1563","5","","B015TYDZTE","b6e5ae99ea044015929b6f2bed47e00fW7QK","as expected"
"1564","4","","B015TYDZTE","7f7a03c96d5af5cc150038254cfe3577O5LE","Happy with the Quality of product"
"1565","5","","B015YYQKCI","7f378183f24607b70ff88aa0c746adc9W7UE","This is a must have for anyone with messy little eaters! It makes it SO much easier to clean off the table after snack, meals, baking a crafts. I am so beyond pleased with this purchase. I even use it to clean off the babies high chair trays followed up with a disinfectant wipe. My only complaint is that my original one had a chunk taken out of the rubber base that makes it a little more difficult to get everything into the pan. But Amazon customer service is amazing and will pretty much always fix a problematic situation!"
"1566","2","","B015YYQKCI","6c50b5ba2e5ab36c44638daacda9b8dcTEF0","I should have read the dimensions on the dust pan, whereas the broom is a nice size the pan is too small to ever use for a spill on the floor. The whole is too small to hang or anything."
