"id","rating","vote","asin","user_id","reviewText"
"1","4","","B011KGD43W","6af1ec283256868099bf56159a6ab2ccDC66","WORKS FOR ME"
"2","5","","B011KGD43W","c51edb398e87b8bdea3790a0238e0f86TI81","There are so many note pads in this set, love it!"
"3","5","","B011KGD43W","d3c5d2575770c6d9a2cf351029b4af5bLVHF","As expected"
"4","5","","B011KH5EV6","5b395070e67f94638e89b321c785de27XPD5","As advertised"
"5","5","","B011KH5EV6","ad5abe6f344b7ab1aed4064c3bd67307CL4I","Fine love the eraser as erases clean.\n\nBJ"
"6","5","","B011KH5EV6","8340e7e910247393b3a35b0a72b3bcdfU91X","As ordered as expected."
"7","5","","B011KGP250","ada970125449252f689fbc3b4122887fI6HX","My old one just wasn't sturdy enough. This one is a pretty good option, but won't staple too thick a stack of paper."
"8","5","","B011KGP250","3e1111aae6a40a3de83af5330edcc62f0UVC","I love my stapler! Buy it! It's great!"
"9","5","","B011KGP250","1cf5584c18d92497595647710057fe0e45YS","This is a very good sturdy stapler I love it."
"10","4","","B011KGNBTE","f72c108610bb84f91f3efd510e3b075eHM7P","Great price for G2s!!"
"12","1","","B011KH4CG4","89ea229d99f472663b09b8d6374e756dB5E7","I'm not sure if it's packaging and/or shipping, but every time I tried to use a manual pencil sharpener (Used 3 different kinds since we have kids) and the lead broke every time! So, we borrowed an electric pencil sharpener and it did not break.  So confusing."
"13","5","","B011KGIUX6","5a206e1f8f98f6f0e5e34487741a39c5YZT9","I was questioning this purchase due to the price point but very happy I still made the purchase. This pen will be snatched up if you do not watch it. Smart buy"
"14","5","","B011KGIUX6","7068dbffdd7830352c598a97fbf9372eAVU4","works great"
"15","5","","B011KGIUX6","b55b125ec80a8326a8f2c95f2fcd3633Q0CY","Comfortable hold, smooth writing."
"16","4","","B011KGIUX6","cf3da3c45637515759a2525db61ab69cH6V3","nice and sturdy"
"17","5","","B011KGIUX6","d9d7b4e912323db38c90fb1410d07e0fO57S","I love this pen. I put a different color ink in it, but it is my favorite pen."
"18","5","","B011KW0VH8","c69b53c0ce71faf2daf074e0faf4529e19YR","Love it and it smells and feels great!"
"19","4","","B011KW0VH8","fc086b5d9baebc2ee569a261cbc0ae1dJ3MR","These scents are a little stronger than most of the Burt's Bees products I've used, but they're pleasant scents so it doesn't really bother me. They're good for chapped lips, especially in the winter air, so I'm happy with them."
"20","5","","B011KW0VH8","25f7f8af929d32f53c2303124f9151fa10ZB","very good to carry around in my pocket."
"21","5","","B011KW0VH8","e4bafa9fc8d6432e25aec26c8d9ce8eeN1C4","These are my two favorite Burt's Bees lip balm ""flavors"" - smell great! Smooth application!"
"22","5","","B011KW0VH8","b295c6f887780d85f3a1db69e8f73a065U2D","I have used Burt's Bees 100% Natural Moisturizing Lip Balm before and was quite happy with it the first time.  I'm sure that I will be as pleased with the Coconut & Pear Lip Balm, and my husband will like the Mango Lip Balm (his favorite) too."
"23","5","","B011KW1HXK","f6bb545e86bda0b8403790c06990dcedQHUG","Because the crystals sink and take awhile to dissolve, they work perfectly for removing algae from the floor of a pool.  My chlorine levels dropped after a week of heavy rains and algae developed overnight.  I sprinkled three containers of this over the spots and the algae was gone in hours and my chlorine level returned to normal in my 30,000 gallon pool. And because it is food quality chlorine, the kids could swim in the pool in an hour."
"24","5","","B011KW1HXK","c5738f2cbe12bb28d4da68a55576e8a09L0P","Super convenient easy to store and easy to use it works just as good as liquid bleach this time you can control it where it does or doesnt go unless you put it there... where is this been all my life"
"25","5","","B011KW1HXK","50e273933a83224d92fdab758c5326d2Y20T","I like it"
"27","2","","B011NJL32K","d0f91b4fbd56365206ec0300a733b6d2ROWS","Iffy. Grass goes bad too quickly. My cat isn't interested as much."
"28","4","","B011NJIXN2","598b789f76146fe3adedb84269c0286aZ7WP","worked really well.  Does not smell great.  Really does the job however."
"29","5","","B011O2IG6M","25dc0f84204a386a3d7a44785766b3b6YBFD","Only brand that works in my dishwasher. Favorite."
"30","5","","B011O2IG6M","734d5016cc289c5949f3f39e944f5656VXZ1","Like the product, love the price at Amazon, love to buy in bulk"
"31","5","","B011O2IG6M","f96ea4bd0c332dba2714be9a5639991302RN","good"
"32","5","","B011O2IG6M","b2edd77ab6fca460b924aa80c7605ce0OURX","The dishes are very clean with FInish dish powder."
"33","3","2","B011O2IG6M","0cd96368e792b34bba7377680cf5d697WFN7","I've used many different types of dishwasher detergent from Cascade to store brand or generic and this is the first time I have ever tried Finish. I like it better than generic brands that I have used as some didn't dissolve all the way and I would end up with a ton of soap residue. Finish doesn't leave a ton of residue, but as far as taking off grime, I don't see much being done. It left a thin layer of milk of a cup and I am always rewashing after the heavy wash cycle. I would probably try an upgraded version but when we already rinse our dishes before we put them in the dishwasher, I would like for the dishes to get cleaned and for me not to still have to hand wash. It's kind of pointless. It's not horrible, but I'm not impressed :("
"34","5","","B011O2H5DC","1e48d9d9e0459519360544699da4facbX6XE","Problem solved with this product, thanks mucinex"
"35","5","","B011O2H5DC","369fbe49ae059a74099ba9835914ded82X24","This is a big help"
"36","2","","B011O2H5DC","47e069f620d1827108344bc79fde70b47Z4X","Just did not work for me,,,,Plus you take two tablets every four hours that just makes this way too expensive"
"38","5","","B011O2JH7Y","f43e513fd95a80420e5a8c9f57f66ed37LYW","All Disgestive Advantage products,are excellent quality and work well. The price is at a level I can afford on a very limited income. I love all D.A. Priducts."
"39","5","","B011O2JH7Y","a3df4ccf1c741f20e4ad08bf3357f665B4J7","This stuff really works to stop gas when eating vegetables and it's much easier to use than beano"
"40","3","","B011O2JH7Y","d7ada7fecebdd7550c98d8bc0a2b692eL1IM","honestly, my inner scientifically minded skeptic doesn't want this to work but i think it kind of does.  more research is needed to form concrete conclusions.  however, i can say for sure that taking these things didn't kill me, mutate me, or cause an alien to explode out of my chest.  at the very least, it seems safe.  will update if i reach further conclusions."
"41","5","","B011O2N9JQ","8d8d22db08c47b5edc132c3b0860f5c3A0G5","Fiance likes"
"42","5","","B011O2N9JQ","55d6270a6a89b0cbbe67e42d414519f7D8PN","Leaves dishes nice and clean, no streaks or film."
"43","4","","B011O2N9JQ","9532523865dfb7cde0ba01bf894fbe7cSXMY","Works well. Nothing spectacular"
"44","4","","B011O2N9JQ","e7a4209a7e04d8a8b87b88029bae0be6V3XD","Sparkly dishes...."
"45","4","","B011O2N9JQ","21e8c3b09767bf3ea94f26226621b9b2Q9B9","works great"
"47","5","","B011O2R9LU","1174d66c266c3b02e69defef3ab21201QFGD","After using the blue stuff for years, I decided to try this because it was one of the ""buy 5, get free shipping"" items on Amazon Prime.  Well, we like it better, for sure.  Pleasant aroma and you don't have to worry about staining from that occasional drip from the blue colored deodorizer."
"48","5","","B011O2R9LU","dbdb19faef846d3cb2ebdbedeb97cf89UX8D","Works much better for us than the powder form and does not leave a residue."
"52","4","","B011O2RSKW","56946b0184165f046fec17b4d9c7741fBBMB","I usually use gel packs. We'll see how this works."
"54","5","","B011O2UWW8","a387d4ae4e4e0ae49307e4dda5623a03HEXX","great"
"55","5","","B011O2UWW8","35bfd68fc71998f6e1b2178d0c8c6c1eTKIN","I never notice any fish-burps"
"56","5","","B011O2XCLG","5ebc67616eda80eef18e7e594bd50cabP2M1","great"
"57","3","","B011O2XCLG","7f8189423ef6131812d3158af2d794134IEW","I try many different types of probiotics because I really believe they address many health issues and overall health. Digestive advantage is a good probiotic from a good company but I did not feel any difference like less bloating and gas like it states. I find that there are better probiotics on the market"
"58","4","","B011O2XCLG","ba2e73d1137cb96856602f09202c9e5a3TSM","i change my probiotics every six month. this works well"
"59","3","","B011O2ORJW","1312de83266a337f369ae33305f03749KGIJ","I DIDN'T LIKE THESE, THEY LOST THEIR SMELL REALLY QUICK."
"60","2","","B011O2ORJW","f5fbed127c4c79b2050c9f4427a4d03b4GFU","Can't smell anything and my nose is like a blood hound"
"62","5","","B011O33ERC","6aee0b07018eecb6c7646208acc6c77cU8M1","Great"
"64","3","","B011O2OLOS","9aef508efa47cda24c760dd89ae62ec463IU","smells okay but doesn't last very long, maybe 3 days"
"66","4","","B011O2V3VC","9153ede1a7409a49d45f708d309a6259MUCT","works well"
"67","5","","B011O2V3VC","54d151d5826b085da974ec85f8a81cd1WJ1F","Nice item... as expected works very well...."
"68","5","","B011O2V3VC","4466c6293bab70ec1b8a664e09a4843aCH02","it worked"
"69","5","","B011O2V3VC","f85528fec7ab43216c0d93cc8be3380fRW5G","Works great for the itching."
"70","5","","B011O32S3I","b8177c97ffaf2fdcc872afe70511006c9TJI","Helps loosen up phlegm and stop coughs."
"71","5","","B011O32S3I","16b0ab07c84137a9509d097007524a25E6HG","A"
"73","3","","B011O32S3I","e7082778fe31b81274a692ae1197aaddG145","I think that the liquid works better for me personally. I have been taking these now for a few days and I still think I should change my name to Molly Mucus or Fanny Flem.\nWhen I take the liquid I still have a clear head and I am able to breathe easier without some rasping sound ."
"74","5","","B011O32S3I","17cc49dc311dd765807295fa13cd91f0ELCK","Mucinex Sinus Max works very well.  Plus being part night (which helps me sleep) and part day is a perfect combination."
"75","3","","B011O2UD4A","6f60377fa59ca5e0bc79ed097d7471c2MH70","My son doesn't seem to like the flavor and was still congested 3 hours after use"
"76","3","","B011O2UD4A","8e9765cd4c78c33da9b9553d951432ecAG8U","Tiny bubblegum flavored pellets or granules (1/8 to 1/4 the size of Nerds candy pellets) packaged in individual dosing tubes were easy to use, and pack in diaper back. Flavor was acceptable by my children and went down rather easy after they figured out how to take medicine like this (tilt head back, open mouth, mom pours pellets into mouth, swallow with some water).\n\nIt does have the same active ingredient as the adult Mucinex which does work for me and my husband. As far as actual efficacy goes, I noticed very little difference in their congestion levels before and after taking this medicine and I am not certain that they experience any relief from their mucous congestion. It may be that my children are young... just barely old enough to take this as it is recommended for 4 years. And up so they do not yet know how to physically cough up and expel mucous. Thus, I'm not sure I would buy again in the near future. Maybe I would try it again when my kids are older.\n\nSo, while I cannot give this an enthusiastic recommendation, I think just like with all other over-the-counter remedies, you can try it and if it doesn't work for you...then you can try something else."
"77","5","","B011O2UD4A","6903a172af40a032b719dc27c1f79e4118Q7","Works well for my picky little girl. She usually has to settle for the orange flavor but I was able to find bubble gum online. This is much easier than getting her to take liquid meds."
"78","3","","B011O347RI","9fe6922972817fd872ddd1ed025300f64M65","can't find a melter any more  :("
"79","4","","B011O347RI","466dea708b95641e5823cb3979e53e276P7F","Smell good..."
"82","5","","B011O32A0E","a8b03e30fd491d58dfd7eab96f8ac092AIVD","It is very good. I like it."
"83","4","","B011O32A0E","45932c5574b54df6f269f45a9c4ba8bbQRE1","good"
"84","5","","B011O2M406","dc68c939b164251bd2c41d51d2aaa778TDU3","I find that this is the best cough suppressant for me.  I have a lot of post nasal drip, many allergies, and it doesn't take much for a cough to set in.  The Delsym, not only helps to calm my cough for sleep but it also doesn't taste foul."
"85","5","","B011O2M406","dc21c4ebde5bf2b2d22751b2b6d13dffUOXD","Delsym is the only cough medicine that actually works for me and my family."
"87","5","","B011O2XJ5K","ff63f7fc9f85af12e7ffe95fc45acac7JCND","I live in the country.  This is a must use product."
"88","5","","B011O2XJ5K","ef0caafe7678841d00828f47125f8067DEDG","Works great cant live with out it."
"89","4","","B011O2XJ5K","8024ca271eed5ac832276d262e8cde38X0QU","Seems to be working well and it easier and less messy to use than the powdered Rid-X"
"90","5","","B011O2XJ5K","b007208365b92fecda669ab648ae0835LARK","Works well.  Use every 4-6 weeks."
"91","4","","B011O2XWMK","81c7cffb9c39c4159b51d82f142d33101QQL","This worked pretty well.  I've since gone to one that is for women."
"92","4","","B011O2XWMK","6fb9e821010d6580b53d49e40783636eZR88","k"
"93","5","","B011O2XWMK","701101d64d95eaaf1583bea93013d0f6Q44S","great stuff.  works well and helps with my ibs"
"94","4","","B011O2XWMK","e718daf3ba72f4ef9fbd3bf13ded9c31WUPI","Even though it only has one strain of probiotic, it is a very good price, and my stomach sits easier and does not hurt as much, when I take several of these per day. Recommend!"
"95","4","","B011O2XQBM","4fa2cf98f69f57a3bc124ca0b0a7e257AGPQ","Interesting scent fairly thick and lasting."
"96","3","","B011O2XQBM","018e3243cdaf4dfc294c9eeafa165ab50RE2","This one feels like it drys out faster than others. Also feels like a warming sensation. Sweet taste to it."
"97","5","","B011O2UKYI","1e48d9d9e0459519360544699da4facbX6XE","Great product and excellent quality"
"98","5","","B011O2UKYI","43c983d53c794ed7cc78ab71fbd3b7f4R6SC","WOW  this works really good better than taking a pill and works immediately"
"99","5","","B011O2UKYI","0f2ec447496a4f70a2a99b85ece535f540LP","better than huge tablets!"
"101","5","","B011O31J8S","fa22f2eba134266d5df45d36733985baI2JH","Great"
"103","3","","B011O31J8S","057aa2f8d7946b1c44e36252293e1243Q3AU","It's basically dish soap. Leave skin feeling very strange and dry. Makes oily skin more oily after 1hr."
"104","5","","B011O4YWQS","ab38b6672d9bf268132a4cec29d76336L4Y2","fav vitamin zero flavor"
"106","5","","B011O4YWQS","645864c852968d381a3a87341d88919dBE75","thank you"
"107","5","","B011O4YWQS","42fff494233e677d5df83d4dfc9b8ab2EL6V","loved this flavor should stock this"
"108","5","","B011O4YWQS","b6b4062ba5f6d5b7f745cd6ef9ce1a065S9S","best vitamin water ever."
"109","5","","B011O2YCVU","e46ac958b66174f23f88343e8189a753B9HJ","pantry"
"110","3","","B011O2YCVU","8785a48a5635c8b1d4e1f17f390ad171I8HC","works as expected"
"111","5","","B011O2YCVU","6778d26baefcbe9b982b803a2f47db63OCH4","Great item, Great service!"
"112","5","","B011O2YCVU","bd8efadd4936232b9628f8e9cf6b3d10JOHI","Works well"
"113","4","","B011O2YCVU","536953c43595f28513aa3985fe4fe12b9DH7","works great!"
"114","4","","B011O2YCVU","1c809079ae2d673aaec42d2595dbb2533OGM","works great"
"116","5","","B011O2L8YY","59d1f95f7514bf06668b9a939358fc511K8N","good!"
"117","3","","B011O2L8YY","23faade52b8f357cdc08bb010071ee03KLPQ","works okay"
"118","5","","B011O2L8YY","ddfd8f40c94a13427b3e06bad42d7aedJ95G","Works great for my 13 year old son."
"119","5","","B011O30X5S","89fb638a0ecf02840ff102ab78d8eb82QUGC","good"
"120","5","","B011O30X5S","6e1d720fd03dffa15f563893a882f2ae4OK6","Exactly what I wanted"
"121","5","","B011O4Y5U6","5bf65c1a6d0a364a24ef7858d757fb58ESA9","Great vitamin water at a good price shipped right to my door."
"122","5","","B011O4Y5U6","1fd1dd1fc2b0f52824faf09df80a007a9CBT","Perfect for my needs!"
"123","4","","B011O2RMDU","4fa2cf98f69f57a3bc124ca0b0a7e257AGPQ","Good and thick. Wears a while and just have to add spit or water even body fluids will keep it wet."
"124","5","","B011O2RMDU","61e4e33ad70f77806ae470e4da086084IRH9","Smells nice! My boyfriend doesn't like the smell of lubricants but he didn't mind this at all."
"127","5","","B011OA77ZK","33c5c9d0d46ff8e5df610d5e20c25e7dAF5E","Good"
"128","5","","B011OA77ZK","dc658971787381e14b2afd3b2e6b44ec26ZD","great product."
"129","1","","B011OA3LVY","ce228a0e7930435ac37113116e433f2f3M0I","Dont use if you have sensitive skin. It caused a reaction."
"130","5","","B011OA3LVY","7dbbb517fa2993ae989499e5329b06f9KNPD","does the job in every way, would repurchase!"
"132","3","","B011O31C76","535a04d7b33282d51d2d9161c0242bbeH1M1","So hard to get pharma products that even do ANYTHING today"
"133","5","","B011O31C76","81352f2be31ac1b3ba5e261e79f9e69aDOCX","OMG these work really well! Colds just made the rounds thru my house and these helped our throats and coughs. Most of the time I buy generic, but cepacol name brand works better for me."
"135","4","","B011O31C76","aff26f25ef43b9f222860d2fc9387b0fJX5J","These cough drops numb your mouth and throat so that you cough less, but there is a price to pay.\nThey are absolutely vile tasting.\nSo bad that it was actually preferable to face the discomfort of my raw throat.\nTaste is subjective, so these might be fine for you, but I'll go back to my previous brand or a different flavor of Cepacol."
"136","5","","B011OA671U","c37ac6b9eb095202937108401aff03d35BK7","I order these again and again."
"137","2","","B011OA671U","7ffa03e33a375c6ab0f1701eb79080feN0P0","These are a little two thick and start making me a little sore after an hour or so. Won't purchase again."
"138","5","","B011OA671U","df71104846f81c95f2af4d659a6d7e603Y8K","it's the only one I've ever used.  don't like the others"
"139","2","","B011OA6KXU","71d717d5ec3204438f43e8716959261bA6RL","The tape on these do not stick well anymore. Before, these used to stick on not move. The wings, especially, always flap around and do not stick, and it sure does hurt to remove the wings from the inner thighs! These definitely are not as good as they used to be."
"140","5","","B011OA6KXU","c0e8bb929d22fe9c276a95294bdad3d13GOX","My go-to for the heavy days.  These are perfect for overnight too."
"141","5","","B011OA6KXU","8ae59e34eeee7bbecf08e98e16996c22WBJN","Great maxi pads. They aren't ultra thin but aren't overly thick, they are fairly long, and the material is comfortable."
"142","5","","B011OA6KXU","2dcfaac0389bb68d61f0a5cd68e4d583HUZ9","These are perfect for when Aunt Flow visits and you find yourself at Niagara Falls."
"144","4","","B011R60BIQ","5c37221b4c37c76e0b2db8daf3f58d4cA7Z6","Not sure if it makes my skin dry"
"145","5","","B011R5ZVFA","5c37221b4c37c76e0b2db8daf3f58d4cA7Z6","Very foamy"
"146","5","","B011R5ZVFA","e36262531c6a26212caaf96d13e2071bOTIV","Yup love this stuff"
"147","5","","B011R616BW","62395e40e852c2aa1eec78522a0e460e6LTS","I really like the gentle lavender scent. The cleaning action is also quite good, albeit not comparable to common shampoos that contain SLS."
"148","5","","B011RA1VVS","3b1f0f610cd5c6ce72015b127a8dcf744UU2","Great product, fast shipping. Just adding to my weird collection of bandaids."
"149","4","","B011RA1VVS","e91950df02607763b6391d23b0bfda39RQ67","Kids Love it and it protects their boo-boos!"
"151","5","","B011RA1NJS","687e53c2e5a827e2d78a9184538fbd485RDW","always a Disney fan ... such a great bandaid and look forward to using them when i need to."
"152","5","","B011RA1NJS","21b94cf6220d612f4d0c5cad1f8cf15eELOR","I mean, they're Band-Aids. You have used them before. The kids love the Disney print, so it's a win."
"153","5","","B011RA1NJS","b21323b52af1bb209af8233b77108e87BEN9","Not only our Grandchildren love these!!"
"154","5","","B011RA1NJS","8a2810d7e80c399e820a3c85754331302MJV","Great size option and super cute. There are multiple design options to keep things fun."
"155","5","","B011RA2FP4","084d8190a3c9c67e8d9bc37b9b6352aaVKR9","All bandaids have Disney princesses. Grand loves them!"
"156","5","","B011TB4J14","9594c838f04e704af28e8796886cdfcfUZ5G","It doesn't smell. Quality is nice enough for the price."
"157","5","","B011TB4J14","74d04c8924828b39ce66fc6f97f5a0c9Q74Q","great"
"158","5","","B011TB4J14","f904463c03ba72fc0e6f407d066c5f94G2ZE","Thank you!"
"159","5","","B011TB4J14","c9ac3a693f439c9bddd911133f400afb46YT","great"
"160","5","","B011TB81LS","904ff563b95057f7e6c72b1633fac62aFWZD","The item was delivered on time and exactly as described."
"161","5","","B011TB81LS","6b34fba17cbb220b603d9f79bbb004a05A36","These are great and I love the colors!"
"162","5","","B011TB5A2G","83243f252d3bcff97eacd72aa2feb48aS15K","I like how well-made they are and how functional and they help me organize like things ... I can look into my filing cabinets and see where all my finance stuff is it's green.. important must keep papers are in red..."
"164","4","","B011TB3KN2","254d72e7d1a446d098044d37d59ba1bc7ECR","As advertised."
"167","5","","B011TB3KN2","026cd1c3f5f385f42f9137c9fcf937318D83","Last year at Christmas time, I had an infant and a toddler and decided not to put up a Christmas tree. My 5 year old was so disappointed so I thought I made a felt tree and felt ornaments to put up on the wall. When it came to actually put it on the wall is when I ran into a problem.  There wasn't a safe and effective way of hanging it up. Tape didn't hold it up, tacks would but if my babies pulled on it, it would pose a safety hazard. So I decided to give this a try. It allowed me to hang the tree on the wall with no problem. It stayed up for weeks of my 5 year old decorating and redecorating the tree. My babies would pull it off the wall from time to time but it took them a long enough time that I would notice and go over before they could put the putty in their mouths.\n\nI also use this year round for everything. Hanging up kid artwork, putting lining in my cabinets and drawers in my rental, adding memos to our visual calendar, etc. It is a pretty handy thing we always have on hand and would probably benefit most household!"
"168","4","","B011TTMY54","5e8252e91ab914c5694ddbff7eb31e2cS2BF","Good product!"
"169","5","","B011TTMY54","9a2220de446e32595678b9d4b08931ca9IKC","These drops are great before using a nasal aspirator to clean out little boogies!"
"170","5","","B011TTV63U","2e29bbaa775e4275f6ca7b138afe8170UHQU","Great"
"172","3","","B011TTV63U","b4f2d14a31b1f1976a9635a58124f64d5XUL","Works sometimes"
"174","5","","B011TTV63U","b89aecfc1dd3a6ae99d6d2106d8860b3FHG6","Thank"
"175","5","","B011TTV63U","fe256befdab8d9e7d1535fa643671e35VOZH","Works great, I only take one at night not the two they prescribe"
"176","4","","B011TTL7G6","15ac8e7307f4e371e812bd3c995da389JFOF","Thx"
"177","5","","B011TTL7G6","bde4f989b6c5ecdec5000131c6abbcf6YSNF","Work very well taste bad"
"178","5","","B011TU7EIU","c3754f881c87773478d08e3e843dd02149FE","Goody's is a good brand that works great and works fast!"
"179","5","","B011TU7EIU","fab5bf1b2788702ae495f9adca23b14cHT1L","Fast relief from headache, I had ongoing headache centered behind my eyes.\nPoured this powder on my  tongue, it isn't terribly hard to swallow down with a chaser of juice or something with flavor. By itself, the taste is pretty chalky and gross.\nYou can also mix it in a drink or food, but I find it's faster acting to pour it into your tongue & drink something immediately to swallow it down.\nMy headaches go away or greatly reduce within 15-30 minutes after consumption."
"180","5","","B011TU7EIU","16487d5c23794f120b68667465934f97ZTHP","Mix with skin cream or hair creme conditioner, shortening, coconut oil, to make a pain creme you use topically. Obviously in the latter two cases you can just eat, but I've no idea how they'd taste.\n\nGREAT for piles, instant relief, far better than Aspercreme or Prep-H.  Apply in shower or after using toilet.  I use 1 wrapper per tbsp of skin creme, hair conditioner creme, and make in large batches then put in jars.  Mix well, allow a good 10 mins for aspirin to dissolve.  Maybe mix it in a little water at first, but not so little it pastes.  That doesn't mix so well.\n\nThe cheaper powders should work too."
"181","4","","B011TU7EIU","71d717d5ec3204438f43e8716959261bA6RL","This is the first time I've tried this brand because it's a less expensive alternative to the aspirin I usually use. It is pretty good and it does work quickly. The issue I have is I can't carry them to work or anything because it looks like I'm carrying packages of Cocaine. Not cool. The packages need to be marked with the Goody's label or something.\n\nAdditionally, these don't dissolve that well unless it's in a hot drink. I have a lot of product left at the bottom of a glass otherwise, and drinking the remaining product is bitter! Even dry on the tongue the powder is super-bitter. So if you want to stir this in a drink, make sure it's HOT."
"182","4","","B011TU7EIU","9c4ea83c076230d62e4e24cd9e37378eP8IB","I'd be happier with these if they worked. Unfortunately, they're hit or miss, and I can't be taking products that don't work with consistency. I have chronic headaches, and if my meds don't work, I'm miserable."
"183","5","","B011TU7EIU","8622421db7afd104fb58356984c83df60M1G","Love this!  I get cluster headaches and this is the only things that works."
"184","4","","B011TTLMDO","15ac8e7307f4e371e812bd3c995da389JFOF","Thx"
"185","3","","B011TTLMDO","5925f567ecbe56b8ba7dbb95c1b8ea76M0HF","does not work as Well as Advertised..."
"186","5","","B011TTLMDO","971a0ff434e0297eac22f4a3a32f540fFZ1K","Product as described. Delivery was prompt"
"187","5","","B011TTNKNO","9a8e5f40108eeaf07af1b9eaa5f7e64cOBS5","Best lemon taste and numbing is not too intense."
"188","5","","B011TTNKNO","cbff0bd2fa9d774786143c8e7c4c0403L5JG","Great taste!"
"189","5","","B011TTNKNO","c934175cbaf5d9cc3a6a359e8de41dc0KDG3","also a good product"
"190","5","","B011TTNKNO","a9524c9ce878d5d3ec0844fb5b5173e7DBZS","good tatse"
"191","3","","B011TTLYPA","a5b365f7c68f38ce08339ecee397d2b1EE4O","Ok 4 price"
