"id","rating","vote","asin","user_id","reviewText"
"2881","5","","B017XKKDDI","10d0cd041d4029996f1c34d4563b8164N75I","very good"
"2882","5","","B017XKKDDI","2e2f6c59f50e970c8f39c79578e54dbbYIXQ","Great! Thanks!"
"2884","4","","B017XKKDDI","d602cd6a546f691b092332e65f92583995P6","Didn't turn out as well as similar brands. It wasn't bad but it wasn't the best either."
"2885","5","","B017XKLI5U","17ca8494b0e3e8ae166ebb100b505591LCUF","Oatmeal is my favorite! I love that it makes a perfect match and it's quick, yummy treat!"
"2886","5","","B017XKLI5U","5ed40285a78d79cbb83dc1287433b38cNWCG","very good and convient"
"2887","5","","B017XKLI5U","7a8bd2f81bedca1502c00c469a446c59PIGK","Add raisins like homemade."
"2888","4","","B017XKLI5U","266c05f738621093ecdabfa0f719b20f92HJ","This cookie mix is very good. My family likes them a lot"
"2889","5","","B017XKLI5U","6e054296ca761bb19e80603a23a75d13UQTZ","Just what I wanted Thank you !"
"2890","5","","B017XKLI5U","e1f4dc15d2f849951c9ce14bef0f81baLPV1","I used raisin and baked great cookies. I think I made about 18-25 cookies. Don't remember because I hate half of them right after it was done. Follow instructions. It's pretty clear. I'd not experiment with different shapes, but feel free to bake any shape. Also, don't put all cookies on top of each other or in any container. Let it cool off first (maybe 30 minutes or so). My cookies got sticky to each other so I needed to eat 4 cookies at the same time or brake that tower and eat crumbs. Don't repeat my mistake!"
"2891","4","","B017XKLI5U","f999fd2810b03b915533f40a798438ef2ZJ0","Great tasting cookies."
"2892","5","","B017XKRTKI","28a230d5583d070b30cf17d566c5684c8ZTP","Great purchase"
"2893","5","","B017XKRTKI","5fada55c17b99a5ca8c6b25239d13326NOA0","Great product"
"2894","4","","B017XKRTKI","5ed29fc19e554bb2f1b935a95fe6fa9cKEQR","its soup"
"2895","5","","B017XKRTKI","40683a25c0f29257ca5fb733a0b02d2fNLY2","My fave! Progresso soups taste great and are definitely worth any price!"
"2897","3","","B017XKRTKI","934e9965d7c1eb83fcacc144f1b835d553OC","NOT ONE OF  MY FAVORITES IN THE PROGRESSO LINE."
"2898","5","","B017XKJV3G","fe7f331d9e5f24a9511d5dfb6ea9d997QSFD","Good"
"2899","5","","B017XKJV3G","a431d1491022dd53226d128f456181a85D0C","It's handy to have at the house to make to take to a potluck dinner."
"2900","4","","B017XKJV3G","ae559f52328eed7082a8e49f9ee5e097H92K","Yummy."
"2901","3","","B017XKJV3G","b6b5115e4b7826521da30d44f6ebb70aA941","Good"
"2902","4","","B017XKONA2","0cc398b739d4681dbbbead4a363877e0U0F1","Pretty good."
"2903","4","","B017XKONA2","8585286a5aaef324943211fc57d2a00bW903","Sadly it tastes about like most easy-mac type macaroni and cheese. I think that Annie's is better than the normal Kraft easy prep containers but neither one is that great. Also it seems like something about the shape of the bottom of this container makes some of the noodles get stuck and occasionally congeal in the bottom."
"2904","5","","B017XKRLUG","5fada55c17b99a5ca8c6b25239d13326NOA0","My familys favorite"
"2905","5","","B017XKRLUG","a013ac55eed68c1765d9252256319aab021V","Have not tried it yet but can looks good!"
"2906","5","","B017XKRLUG","b398df5eba57d6c37c2c3206a03f5141ELBG","great food"
"2907","4","","B017XKRLUG","17309945ac4955b7eace18602b517676N2KO","I add garlic and more seafood for a quick white sauce which is lower in fat than making from scratch."
"2908","5","","B017XKR3NG","236148064a8321bc4e76100e576a43e2VPEY","I love Progresso Soups. All the Progresso Soups that I have are the pop top lids. I have a weak hand grip. So having the pop top lids make it easier for me to open. Now I do have a electric can opener. But if the power was to go out. My electric can opener would not work. And having them deliverd is great."
"2909","4","","B017XKR3NG","d6c19838c78a48887109af03bb2b137cVWLI","Tasty"
"2910","4","","B017XKR3NG","ca596a1f6d80978df59f3f9b4d80b81e59OX","Awesome with just about any kind of sandwich, though. Goes amazingly well with fish sandwiches."
"2912","5","","B017XKR3NG","b6d17f9b75665cc777688b11dceebd15AIXC","This is a great soup with a lot of fresh tomato flavor. Love it even more when someone carries it to my door."
"2913","5","","B017XKSVV4","80dec05be0e48f80845a1dd437db8da4ZPLS","My daycare kids love ninja turtles so they were excited when I got these for them!"
"2915","4","","B017XKSVV4","d857a92e92f08cc95cdd948ab97e4952C9SX","kids love these"
"2917","5","","B017XKSVV4","937e82cc8168bb38226fa66af6d0f9ea95BR","These are awesome. I am in my thirties  and love them and our kids love them too. Great taste !! Love the T.M.N.T shape as well- :)"
"2918","5","","B017XKSVV4","d91054837b475dac1b4202ad1113ff255O38","Taste great and the kids love them!"
"2919","5","","B017XKL54Y","b4bbc91a935a20e1d93f3252bae6661aQPQH","Great flavor, and exactly as described."
"2920","5","","B017XKL54Y","5302d144cb30f2081b7c14ea1364ff101NTB","Great basic vanilla cake mix.  Always comes in handy."
"2921","3","","B017XKL54Y","d31f5b0a1584437c7cb15bf1b1b28d0dLZHE","ok"
"2922","5","","B017XKL54Y","84610fc6e04ea0f4a5f1e592a7b50728JGUT","I normally purchase Duncan Hines (I was a cake decorator years ago and always used Duncan Hines when I didn't do homemade). I'm glad I took a chance and ordered this one. My husband loves it. It's delicious with either a strawberry icing or a caramel icing."
"2923","5","","B017XKL54Y","f99f1d142c1cb69e826aae81a2ca5d9fJSWI","Wow this cake mix is to die for."
"2924","5","","B017XKL54Y","3ffd79f287411f39ec8bea8b3ce888afHSPI","This is the only cake mix that taste like it's from a bakery. It's perfectly moist and has a rich vanilla flavor! It taste amazing with the rainbow chip icing. My whole family agrees this is the best box cake mix!"
"2925","5","","B017XKL54Y","9edaee5c575b4ee9f5b617aff4404872TC08","GREAT TASTE, GREAT MIX."
"2926","5","","B017XKK9DM","0003d72cca5fd263a68de297b1fe2a27C4ES","Great quick last minute treat for the grandkids."
"2927","5","","B017XKK9DM","f99f1d142c1cb69e826aae81a2ca5d9fJSWI","As always you cant go wrong for a cake mix that taste great."
"2928","5","","B017XKK9DM","c0a528b5e09550f570e8affdf5669875T0XV","My husband loves this brownie mix."
"2929","5","","B017XKK9DM","7cd491e534616c1325f48769ed47c1a58AVE","As expected. Fresh."
"2930","5","","B017XKQDHS","7ae63d14c427e0c85e8f56094895234ePGCH",""
"2931","5","","B017XKQDHS","83014824a75129f7a6fd6ac3bb020e13RS78","Shells were all broken, so I made a casserole! Delicious!"
"2934","1","","B017XKQDHS","bbfab38ca57f3e1939d352e0e15e863eS4FP","Stale when I received them."
"2935","5","","B017XKQDHS","95936b66715b743c5559480af03a5453V1ZI","Right size and thickness, have a nice corn flavor and come in handy for the times I am too busy or lazy to make my own from scratch."
"2936","4","","B017XKQSU0","95936b66715b743c5559480af03a5453V1ZI","Great sauce if you are in a hurry .... but still not as good as homemade!"
"2937","3","","B017XKQSU0","1031440aa4a2acfe836a51ee21bacab99AJ8","the taste it seemed to me would be best in a molee dish not enchiladas."
"2938","5","","B017XKQSU0","a0c21dae0d8d5398a7b2fffb4246d56f3EVO","Very yummy enchilada sauce!  Not too spicy."
"2939","5","","B017XLFQLG","1dc8d7c14413f2925a60b99aca2e6530RK7X","hands down this is my favorite cake mix. I use the coconut pecan frosting with it. I can eat this made up properly, or just as cake mix, with water only added (to avoid the worry of bad egg problems). I literally buy 4-8 of these a month."
"2940","5","","B017XLFQLG","e64754d85706ced07f26b0065b97797eFCCN","It was moist. It was cake. And it did taste german."
"2941","5","","B017XLFQLG","c0a528b5e09550f570e8affdf5669875T0XV","As good as homemade!!"
"2942","4","","B017XLFQLG","7a2b5ee9c0474579983524129610ecddK56S","Who could go wrong with Betty Crocker?"
"2943","5","","B017XLFQLG","24d3cb3c8d521b42d6f5a1c9c46c952dJY89","Yummy"
"2944","5","","B017XKSP0G","22aee85e213c413ff233f6c6b2ff019bPRIX","Worked out well."
"2945","3","","B017XKSP0G","5a0c859156675ebe04722a2b95419fcaC1RB","Expensive"
"2946","5","","B017XKSP0G","1fde66f2b74581c51bac527df5bf6815FU6C","perfect"
"2947","5","","B017XKSP0G","0e32237af478a987cc09bca15a7f4449ECSN","Great product I'll be ordering more."
"2948","3","","B017XKSP0G","1ad520f8d634af2db32ea9f2accae2e1WUK5","More flavor needed,  even if drinking just as a brother.  I do have some other seasoning that worked will with the broth though and will buy again just for back up."
"2949","5","","B017XKQLPC","9b47c9006b92a5b7a62429b282458261NIQA","Old El Paso Vegetarian Refried Bean, great taste all around, just love them. Real good buy. Winner in my book of life."
"2950","5","","B017XKQLPC","6d0ad78b27c812a4ea62ad8cbbd5c6497KOB","Great!"
"2951","4","","B017XKR6N8","1d02fc759800428ed7233ec578b465a6EA8F","I'd give this 5 stars but I don't like the kind of noodle that's in it. I do appreciate that it's low fat and has some added carrots, etc. I like to heat a can of this adding half a can of carrots and some green peas."
"2952","5","","B017XKR6N8","5a2c497ffc395e9933f99ea8d5182fb68YTB","I have written my reviews on these soups. i LOVE THEM and this is THE BEST SOUP IN A CAN!!!! highly recommend! i wish there were more light and/or sodium free soups. There are never many of that kind and when you get 1 there are not any others.\nthis is my favorite soup!!! Highly recommend trying!!! really great with the Club small crackers too!"
"2953","5","","B017XKR6N8","f7ba1063463fd00bedba8b0ef3ed3dbc0NUG","Great Product"
"2955","3","","B017XKPYKU","3020834d1ca8d63ae15d61e9cac157a2E0QE","Your basic store bought.  Okay taste and great in a pinch if you can't make your own."
"2956","3","","B017XKPYKU","a5b365f7c68f38ce08339ecee397d2b1EE4O","i liked them but they got hard fast once they were opened even with the resealable  package they were a bigger size than I expected, you could cut in half and get double the shells"
"2957","5","","B017XKPYKU","1b92a516aa9ffa02e1e9b89a10e1bbdaNINH","Yummy!"
"2958","5","","B017XKPYKU","42260ea8b6a92e261dce4d184b4c0c2cK345","Very good!  Will buy them again!"
"2960","4","","B017XKT5BE","80dec05be0e48f80845a1dd437db8da4ZPLS","My daycare kids liked that they were shaped like kitties!"
"2961","4","","B017XKT5BE","103f7e29e80b9cf67b9f6db075cf3c2aTCW5","not as good as i expected, but still decent."
"2962","5","","B017XKT5BE","bbab709234223175466c4324fc72b19dYQ9J","These are delicious! Fun shapes and colors, great flavors. I love these because they don't use coloring of flavors from artificial sources! They're a healthier choice and they taste great!"
"2963","5","","B017XKT5BE","1a89490fd57b8c2f6a35ad0cb782a01dW10F","tastes great"
"2964","5","","B017XKT5BE","a5f321c7f9d85c3f4925dbe0b05d34c7BO2N","My granddaughter loves these."
"2965","3","","B017XKN9F2","3aa15552911666bde03eb866e5d9b34dR57Q","Its hamburger helper what else do want me to say?"
"2966","5","","B017XKN9F2","b033272e5e4fedae67bbe1b3612a4ebb6QYK","I buy it for taste love the cheeseburger macaroni hamburger helper. would recommend to friends ,family"
"2967","5","","B017XKN9F2","56d5c27be693ae05ffc74369139160b74WJF","perfect"
"2968","5","","B017XKN9F2","baa5da82ec3e5d454e2c96d17338e820B3TT","It's the great tasting hamburger helper that's always delivered by Betty Crocker brand. And at a very good price."
"2969","4","","B017XKN9F2","c8e6e656811f05f01b7c3cccc9ce929dFFVW","I have used these for years for a quick lunch or evening meal."
"2970","5","","B017XKN9F2","fef5971a531d800d099ffa064dcb9e11CLLH","love this product"
"2971","5","","B017XKN9F2","3f6e26485fca5d28c5458ed21d5dfe319UD2","Good"
"2972","5","","B017XKN9F2","074c5592d2b50e29d22943ece4e27b6057A7","Exactly what I was looking for!"
"2973","5","","B017XKPPRW","d6e532e3d30e243866070e93acdc6914HFNS","Great Buy"
"2974","5","","B017XKPPRW","ae1b90737651d4744284c71d4b14facdQ8NH","Perfect for when you either do not feel like mixing your own taco seasoning, or maybe have run out of an ingredient, and this one, with less sodium, seems to have more flavor."
"2976","3","","B017XKPPRW","73c7f01e199c96946d80c443bbf74deeKVH7","Waiting for another company to come out with a taco seasoning mix."
"2977","4","","B017XKPPRW","1d5cb4fde98478f557ac49776e7ba0b2P7DJ","I like being able to reduce the sodium. Still tastes really good."
"2978","5","","B017XKPPRW","0faad5853ef65350d5ac90bfd5bf0d08D25E","Recommended for anyone who is on a low salt diet old El Paso taco Seasoning 25% less sodium."
"2979","5","","B017XKPPRW","9f3513507f4c1ce79f8d4989eedf226b2YI5","Great item"
"2980","5","3","B017XKPPRW","8b7612590eb2cfd2fd16a2d28a6a85deBR4J","This was a very tasty product, and you couldn't tell it has less salt in it. I used pieces of chicken breast instead of gr. beef for health reasons, and it was even better than I expected! I will definitely be buying this again, in the future that is."
"2981","5","","B017XKPPRW","e494137ded59cc172e100dd01f966d23ORN3","smashed along with the biscuits and ceral."
"2984","5","","B017XKQ39G","35b9becfecc4f90571c54bfaf2193d17N81I","YUMMY"
"2985","1","","B017XKQ39G","b43d51a308208a428fd3e88288d0b2b8WY5P","Everything in the pantry box was all smashed. I spent all this money and it was horrible."
"2986","5","","B017XKQ39G","cea1cead08666197f2b2e45188f28727V5DE","taste good few shells broken"
"2988","4","","B017XKQ39G","4b5e3fc23b2ef5747a9bd54dae87790762CX","Everything you need to get taco night started."
"2989","4","","B017XKSKBA","c068ee4aca8184363d2e7cf0d8c1fc01V736","Good Stock"
"2990","5","","B017XKSKBA","8a8083c6b4d50303d5aa1ce3f6d5141b5XVG","Trying to find vegetable stock that doesn't have an overwhelming onion or celery taste can be difficult, but this stock by Progresso is rather impressing. The blend of veggies used give the stock a nice natural taste, and I love how it's not laden with tons of salt. Low-sodium vegetable broth is very difficult to locate, but this might just make the search over. I've used this stock in soups and stews, casseroles, mashed potatoes, and even in place of milk when making an omelette. I like having several of these in my pantry because they make everything taste delicious!"
"2991","5","","B017XKSKBA","0e32237af478a987cc09bca15a7f4449ECSN","Great product I'll be ordering more."
"2993","5","","B017XKSKBA","567bd96d766b3581ab074f9705379d3fE7Q6","Vegetable broth is a good standby for cooking and this is a nice product.  It's great to have on hand."
"2994","4","","B017XKSKBA","0bfc34763aedff23e0d6fccc90779d40MFBG","Bought this stock to make lentil soup.  Tastes good but I'm wish they had the low sodium option available..."
"2995","3","","B017XKSKBA","1ad520f8d634af2db32ea9f2accae2e1WUK5","Not really very flavorful. Needed to add additional spices."
"2996","5","","B017XKKKJA","d8ca12dc76afc6782f1a39b860459257D50Y","Love"
"2997","5","","B017XKKKJA","e302eddae1fb339e0bad35f4e7ffcb0dF9ME","I received the product as seen and I was pleased with my shipment. Thank you"
"2998","5","","B017XKKKJA","48a95cd9fb439fdb091e43cacdb5688a0MWR","If you like your brownies with a rich chocolate flavor with very nice big chunks of walnut pieces, this from Betty Crocker is my go to mix. It is easy to make and is reliably delicious. I can whip this up in under 45 minutes and I always get rave reviews.  I chill these and put a hunk of ice cream in the middle and I am Super Grandma!"
"2999","5","","B017XKKKJA","ad6de967a8fc9309b276bf9620525c35B9KE","Delicious"
"3000","5","","B017XKKKJA","0f993c3c0220edd6cc86770fd3a0ef90V34I","gift, lots of thanks"
"3001","5","2","B017XKKKJA","a2a7cce7ebf021dfaec5e4b68793672aVION","Awesome product.  These are my favorite brownies.  They always turn out great.  They are so reasonably priced, and offered on Amazon through Prime Pantry - a great deal!"
"3002","2","","B017XKJOQA","d5b39014b97d7b2f64d74c8bf4dbaa6aTQYP","Didn't care for the taste."
"3003","5","","B017XKJOQA","7cca5cea20e4ed384c273f97459fa73bNMEL","filling the pantry box"
"3004","4","","B017XKJOQA","266c05f738621093ecdabfa0f719b20f92HJ","My family likes these cookies. I will buy them again"
"3006","5","","B017XKS16Y","956d263df24c650a1e16d75cf356a0978752","Item as described."
"3007","5","","B017XKS16Y","76b295c60fab0f1c9305d7aca52d99b6214U","Perfect quick lunch"
"3008","5","","B017XKS16Y","5c6319b94417b9b5707660bc4126f5782JLU","Great tasting soup!"
"3009","5","","B017XKQO40","1a98b3452bd83208d10b6dc07457000b90D4","Pretty good. I ordered the mediom5 by mistake. It's pretty spicy. Hubby doesn't like spicy. Oops. Bit it was still really tasty. I loved it, personally. I like spice."
"3010","4","","B017XKQO40","3e1435a919774457b46221db05569746SS48","It's a tad thinner than we care for, but the taste is very good.  We use it in most of the Mexican food we make at home.  Their idea of ""medium"" is our ""mild"", but some chili flakes or cayenne makes it work ;)"
"3011","4","","B017XKQO40","cd39b3605ec995628eefca6d4c7ce753ZGAT","Is as advertised however one of the cans came in dented."
"3012","2","","B017XKQO40","1d9ae07d25449711e6c08f9e0ee0610eZUJX","I used it but it had hardly any flavor."
"3013","5","","B017XKQO40","95936b66715b743c5559480af03a5453V1ZI","A good 'medium' taste but it could have a bit more fire!"
"3014","1","","B017XKQO40","8f2234c3f1e04c8c4796fdeb03a328298CAT","Cans dented and smashed,I get botulism I'm suing......"
"3015","5","","B017XKIUHY","555fad419889b6c8a1a77e724d5ae6fcIN2I","YUM"
"3016","5","","B017XKIUHY","a08eb5fd931b39382aa6a45c010f05d2EG3C","easy use"
"3017","5","","B017XKIUHY","2dc83c98f9042deb472855e475c69ce04WLE","Taste good! Will order again!"
"3018","5","","B017XKIUHY","f99f1d142c1cb69e826aae81a2ca5d9fJSWI","For on the run breakfast these are just what you need."
"3019","5","","B017XKIUHY","cbff0bd2fa9d774786143c8e7c4c0403L5JG","These are great!  I've made pancakes at work on an electric skillet and I've taken these camping.  Great taste and super quick to get breakfast on the table."
"3020","5","","B017XLFTTU","5b395070e67f94638e89b321c785de27XPD5","As advertised"
"3021","3","","B017XLFTTU","369c381789247f8389ffbb7ddc65b2155M4C","Quick dessert...dressed it up by putting Apple Pie filling on the bottom of the cake pan instead of icing after baking."
"3022","3","","B017XLFTTU","de0ec5468d0f048a6d483d1df83b6037OXAG","A bit sweet"
"3023","5","","B017XLFTTU","20f38843c1d763890b217da9668be2b55R7C","Perfect."
"3024","5","","B017XKKHHK","389bfc54f756bcd572373cfeb9334a4178J6","yummy"
"3026","5","","B017XKKHHK","1dc8d7c14413f2925a60b99aca2e6530RK7X","Good quality. Perfect for chocolate or yellow or butter cake mixes. Also good to use in making fudge."
"3027","5","","B017XKKHHK","10d0cd041d4029996f1c34d4563b8164N75I","Good, icing and easy to use."
"3028","5","","B017XKKHHK","60ef5915fb4c83ed2da08efb9bd069aeZPIX","What can I say choc icing and graham crackers"
"3029","4","","B017XKKHHK","2962cd212ba3c1c4db93601a9a94d64f2P5U","great product"
"3030","5","","B017XKKHHK","ab5b4faf3e932c55452382aa4f965691Q8VB","Such a temptation not to just eat this out of the can ... is just the right frosting to frost a Super Moist Betty Crocker cake.  Sorry, Duncan Hines, this is so much better."
"3031","5","","B017XKKHHK","0bc3a6b0c2bc80757352a25ef3a2279cPLGW","Good quality for price"
"3033","4","","B017XKP2W0","22a9cb3c18c1091af92d5b5c8bd937b4YEQE","Easy to use, a little or a lot it's up to you."
"3036","5","","B017XKP2W0","b4527a2a3d669ddc62659d1cc41e8efdFM9U","The best  and easiest seasoning for tacos, chili, or anytime you want to go southwestern."
"3037","4","","B017XKP2W0","95936b66715b743c5559480af03a5453V1ZI","It's great when you need it in a rush but does not beat my own recipe."
"3038","5","","B017XKP2W0","8a17aed0cc20b3b18d0916b3a10766447OYG","THAT LITTLE BAG MADE MY TACOS GREAT!!!"
"3039","5","","B017XKP2W0","7bde713d6ee8bf770c77c0ede7a70f7fRSJ6","Gotta keep these stacked up for those times you run out of taco kits or accidentally toss the seasoning packet."
"3040","5","","B017XKP2W0","212e9ded22f78c9650b9f378ea918576MTGS","Great taco seasoning. Easy to cook with. Flavors beef or turkey."
"3041","3","","B017XKTHM6","6c9b6d59fc4240858ea368939208ace2QY6B","Kids like them, we won't purchase again, not very healthy."
"3043","5","","B017XKQXW8","fb6df81f9d0d98d38269c18305e58b0aD09F","Great tasting and you can get them quick"
"3045","5","","B017XKQXW8","24be73f8fa34d8b46ab0846072d0b2abI0ZS","This soup is very tasty!  You cant tell that it is low fat at all.  I bought more for my house and also for my parents.  Great flavor and nice wide noodles.  I add low fat cheese on top and makes for a great lunch!  Will for sure have some in the pantry at all times!"
"3046","4","","B017XKQXW8","88de3222572c56dcb24f13880398221418GS","Good taste, low calorie. Will buy more."
"3048","5","","B017XKL7RO","6095247500ccd299346dfcdfe62e81ebC07K","Excellent product"
"3049","5","","B017XKL7RO","3fc5b718402351a2bfdc7b2b84c16476J17X","Love it great tasting"
"3050","5","","B017XKL7RO","73f7e799c03625072b72c1a2171a9b6aC832","great"
"3051","5","","B017XKL7RO","c8e7f8f8870e01942d8b871280a353a9S4S4","good"
"3052","5","","B017XKL7RO","678d069bc0af6c77b83a27d5de6facdaCV68","Pretty good, a bit too sweet"
"3053","4","","B017XKL7RO","28b39cf445a655599b7eaab64394e437EEJE","Great frosting."
"3054","1","","B017XKL7RO","a1ea5e117a243e41c5eee35aef08194493B6","I usually love cream cheese frosting but it can be a little heavy to I was excited to try this. I was super disappointed when I tried this, it tastes like chemicals. It's actually pretty gross."
"3055","5","","B017XKL7RO","a431d1491022dd53226d128f456181a85D0C","I like to put food coloring in it and spread it on sugar cookies for Christmas treats."
"3057","5","","B017XKNH0E","950761559c5eb332068c06b4b5a4531dD941","product as described."
"3060","5","","B017XKNH0E","ed0d130452101c422fb91c35d04e649fBI0U","One of the best Hamburger Helper flavors ever."
"3061","5","","B017XKNH0E","ff89f958108c0c8d78c8cb8e5bb0fbbcPAE3","This is great for those quick dinners when you really don't feel like cooking. Hamburger Helper has a lot of great flavors and are always good quality. The three cheese is really tasty and my kids really enjoyed it."
"3062","4","","B017XKNH0E","4b589a4f32b8eee7b76ce00b71b7635e0Z5C","Pasta, extra cheese and hamburg. Still can't go wrong."
"3063","5","","B017XKNH0E","8ec300ce0249872718fa0e68298bb6eaTMJ9","hamburger helper is a great way to make a meal last longer."
"3064","5","","B017XKNH0E","f0371dca6358652526354bdd84cd9cda9VON","loved its delivered & no grocery store is needed"
"3065","4","","B017XKO1YU","132e029411fc7321fb1df54a78c9447517VO","Good to have on hand when you're out of ideas for dinner."
"3066","5","","B017XKO1YU","0cbb5dfd5e61f608b91575e8fd11aa71EBSY","Very easy to make & very delicious."
"3067","5","","B017XKO1YU","fef5971a531d800d099ffa064dcb9e11CLLH","really love this product, have ordered this before and will be again"
"3068","3","","B017XKO1YU","2e4ab1914fd7764bc0ff889f54c417f824EW","good once in a while, not good warmed up"
"3069","4","","B017XKO1YU","e8e127cab55fadebf76e03dc0ec3c40aC246","good"
"3070","3","","B017XKREIA","386a4241036e5e503a7a9cd290cf21fd3BH9","too much liquid"
"3071","5","","B017XKREIA","6cbfbee3f4de0056f16e2fb0be584579DC1K","Good"
"3072","5","","B017XKREIA","5fada55c17b99a5ca8c6b25239d13326NOA0","Progresso soups rated number 1 in our household"
"3073","5","","B017XKREIA","2dc83c98f9042deb472855e475c69ce04WLE","Taste good! Will order again!"
"3074","1","","B017XKREIA","10be53558414e0422a9efd5c74a4d202DUHR","good but not like any chicken pot pie I've had"
"3075","3","","B017XKREIA","f5b69f1764d063f933ab926c55fc555641IB","Okay. Not Great"
"3076","3","","B017XKND6W","3aa15552911666bde03eb866e5d9b34dR57Q","Not bad for box mix"
"3077","4","","B017XKND6W","e8e127cab55fadebf76e03dc0ec3c40aC246","good"
"3078","5","","B017XKND6W","940ed09297652e38fe3e1537f659bba165QA","One of my favorite sides for dinner."
"3079","5","","B017XKND6W","a6ad40f870c0fa8beb836eac5d29fe5fBPBH","I love most of the Suddenly Salads, they are easy to make and you can add a can of chicken or tuna for a complete meal."
"3080","5","","B017XKND6W","e082ef99ee4746714f9731d33ae9d2b7FP29","Great dish to make quick"
"3081","4","","B017XKND6W","5bd8d9d7b0d8166c4e9978a002ce56ae94AZ","Good but crunch is lost if eaten the next day"
"3082","2","","B0181V68HS","dbf4b15006325b418f497832cddf506c46WB","Does not taste like the larger bottles of this product. It tasted stale/old/off."
"3083","5","","B0181V68HS","c69c44960972adee7d2ea4c38dae977cUOBP","great flavor"
"3084","5","","B0181V68HS","f71ba30cc71ca29f504276d5a0a20999KY9I","GOOD"
"3085","3","","B0182G4PJK","c6bf0c1037b37b06be2a0524658e5cd7CP2L","This isn't exactly ""Rapid Clear"" although it does a good job. I don't like it as well as  similar Neutrogena product.  However, I use which ever one I grab first."
"3086","5","","B0182G4PJK","7dc4e0b0a6837dc307ece0332c5886fe7YDV","Does a great job with this stubborn hidden pimples. This stuff is prescription strength Excellent!"
"3087","5","","B0182G4PJK","536953c43595f28513aa3985fe4fe12b9DH7","works fast!"
"3088","5","","B0182G4PJK","1fde66f2b74581c51bac527df5bf6815FU6C","perfect"
"3089","5","","B0182G5FYY","89ae2c54765e05dc72ab39fd5b0eee387PJV","Keeps my teeth squeaky clean."
"3091","5","","B0182G7SGC","a49a602fc60a6218a8c12599bea25ea1X7DS","Because as I've aged I've developed multiple sensitivites to products, I've been on the lookout for an eye cream that doesn't send the area around my eyes into eczmema.  Burt's Bees, with its lack of petroleum products and silicone, has been exactly what I needed.  It gently moisturizes the delicate skin around my eyes with its natural ingredients and soft, spreadable cream.\n\n-- Debbie Lee Wesselmann"
"3092","5","","B0182G7SGC","59d1f95f7514bf06668b9a939358fc511K8N","Cute!"
"3093","5","","B0182G7SGC","3baa13d9d9ad53a009366a2a8c3fc3bf5R0H","Not overly oily and very soothing for dry under eyes."
